"transcript_id","original_text","guess_text","transcript_line_status_id"
89,"Well my name is Joel For am going to have a conversation with Frank Sr for visible","Hello,my name is Joel Fram, and I'm going to have a conversation with Frank Sr for visible",4
89,"light in the Oral History Project at the New York Public Library it is now","light in the Oral History Project at the New York Public Library. It is now",4
89,"Thursday November thirteenth two thousand and fourteen and this is being recorded at","Thursday, November thirteenth two thousand and fourteen, and this is being recorded at",4
89,"the. At the library branch on Twenty eighth street.","the, um, at the um, library branch on Twenty eighth street.",4
89,"In New York.","In New York.Joel",4
89,"Friends family. Family something here tell me what were your","You have friends and family here from New York. Frank tell me something about where your from. family, and something",4
89,"from your childhood.","and about your childhood.",4
89,"Great My mother's first post. Thank you comedians well","Great man, well first of all it's nice meeting you, Joel.  Thank you, good meeting you as well. ",4
89,". I don't really","Yea, yea, and um, um, I  was born and raised ",4
89,". Live. Birth. And I'm","in Harlem, um, blind from birth and ",4
89,". Really good that's base that's why","and um, really that's uh, that's my base, that's my",4
89,". I don't. Want to.","my home, ya know. Hmm.... and a, I had wonderful, beautiful",4
89,"Be you know times","beautiful parents, um",4
89,".","umm, theyŕe, theyŕe both deceased now but ah, I'd ",4
89,"Sake. But. I'm proud of the fact that I'm sixty one now","say uh, but a (laughs)I'm proud of the fact that I'm 61 now",4
89,"because for so long.","because, uh, none of my parents made it that far, so.... Oh, good.",4
89,"Live a. Little. History and or","I'm livin' on, uh,  beautiful time right now. (laughs) History in Harlem was a",4
89,"a little over thirty fifth Street. Madison Avenue and Lincoln","I a grew up on a 135th street, Madison avenue and the Lincoln project.",3
89,"projects and there are two.","projects and then when I was 10 we moved down to,",4
89,"Hundred and fifty street. Savage on. Tap","115th street, Spanish Harlem and the Tap.",4
89,".","hmmm, kay",2
89,"And.","And youŕe now living in the Bronx",2
89,"You know living in the Bronx are","And youŕe now living in the Bronx, right?",2
89,". Cautiously","Ah, yea I do live in the Bronx, um uh, I live up in co-op City",2
89,"Mary. One door beautiful grass three wrote."," Married one daughter and a beautiful grandson, a three year old.",2
89,"Oh OK so it's","Oh ok, great, so whats that. ",2
89,"grass and it was juice.","Grandson's name is Jahson J-A-H-S-O-N",2
89,"G H That's OK. OK. He's","Oh, ok.",2
89,". He's. Really good. Cycling","He's a really, uh, he's like getting a . He's. Really good. Cycling",2
89,"all about the future you know and hold something","all about the future you know and hold something",1
89,". Say again","",1
89,"you know you can see the future or at least","",1
89,"both. The oldest of","",1
89,"these three three R.'s is actually","",1
89,"useful.","",1
89,"My hopefully that's a good thing. Three","",1
89,"things. It was people. Yeah you know lettuce and of those thirty two","",1
89,"thirty one. So I.","",1
89,"Do remember the days children you know I told my","",1
89,"kid my kid out. By the way. So","",1
89,".","",1
89,"That's great. And what's your","",1
89,"question.","",1
89,"Well my last name is Rose. Quote nobody","",1
89,"knows.","",1
89,"OK. And and your daughters their daughters' names","",1
89,". This year.","",1
89,"And tell me what a world","",1
89,". Yes I mean you know all over the","",1
89,"center always seems to still work","",1
89,". How did you get into just parents really think","",1
89,"because they are from birth. You know music","",1
89,"was always an inflated house whether it be brothers didn't","",1
89,"do well you know you're doing OK","",1
89,"six years all sides. But","",1
89,"you know.","",1
89,"It was all around. Come home and I think my mother","",1
89,"when I was probably two or three. You know something big for","",1
89,"her son and she kind of you know pushed me away.","",1
89,"Well every abusing or do","",1
89,"I just have to tell","",1
89,"us the vote you know so I was always playing drums","",1
89,"or kind of you know messing around with H.R.","",1
89,"three Well you know I carried so","",1
89,"we went to try. And. Go. Through the. Regrettable","",1
89,"lesson she was beautiful. She sat on a damn thing broke","",1
89,"on that was probably the first time we actually","",1
89,".","",1
89,"Lost so. That's","",1
89,". What.","",1
89,"I do you teach yourself what do you know.","",1
89,"Yeah.","",1
89,"Around Still I would touch a piano","",1
89,"design and learn play grandfather.","",1
89,"Grandfather. Was talk way so I will be","",1
89,"here and there and we jam on the piano.","",1
89,"You're also a love scene","",1
89,"played it all the time and then there were also you know in the","",1
89,"church my grandmother's son. Being","",1
89,"too about this thing. My grandmother was a Catholic so","",1
89,"raised so we had it all over you know seeing","",1
89,"him both a different spin on different kinds of music","",1
89,"who was doing them and all that kind of stuff so it was","",1
89,".","",1
89,"The same music and music. My parents private that's","",1
89,". OK That's cute. To.","",1
89,"Hear. This kind of music","",1
89,"you know.","",1
89,"Yes very little but I was telling people that I am really","",1
89,"soul singer. Who loves to do standards you know. But I looked","",1
89,"at the result of us it is because there are so many really really","",1
89,"beautiful scenes out here. You work.","",1
89,"That I have knowledge history","",1
89,"of the jazz technical stuff the theory and I don't have that","",1
89,"stuff but the Iranian state","",1
89,"so therefore Sam always still more but I do sing jazz","",1
89,"with a twist and so on.","",1
89,"So everybody can relate to it.","",1
89,"Is there any","",1
89,"chance I'm sure it's well I don't","",1
89,"know but by our rules I mean it covers such a wide range.","",1
89,"James Brown Sly Stone King Cole Ray","",1
89,"Charles Lou Rawls. Elephants just survive it because they're all different","",1
89,"styles. So I do whatever that style is you","",1
89,"know that's what I meant today.","",1
89,"OK.","",1
89,"And before I do perform publicly and","",1
89,"I have I have a website which is W","",1
89,"W W that Frank Sr That","",1
89,"com F R A N K S E N O R.","",1
89,"That and you got that. Yeah and if","",1
89,"you go there you know if anyone is listening","",1
89,"go to the site and you can always follow my calendar as to where","",1
89,"and I do have a CD burner in the studio right now working on","",1
89,"my second CD.","",1
89,"Then you know really the problem here but I have","",1
89,"somebody that's created this is the first","",1
89,"one was let me be frank.","",1
89,"Then it was changed to listening in the dark so when you hear it good","",1
89,"either way I'm interested to","",1
89,"know where","",1
89,"the other members of your your family blind not just just","",1
89,"myself and whether it was I","",1
89,"mean you say I was premature.","",1
89,"So it wasn't anything that was hereditary. It was too much oxygen","",1
89,"destroyed the optic nerve circles because being an incubator","",1
89,"too much oxygen so so that is how I want to","",1
89,"live but I was one pound twelve up twelve ounces here so you know","",1
89,"I was still people around here you know I didn't know you're here you know","",1
89,"I do know you so I was one pound twelve ounces and","",1
89,".","",1
89,"You know a lot of people. Just say","",1
89,"it was lose oxygen shows bring it a little bit but","",1
89,"you know and maybe when I'm here.","",1
89,"Yeah have you","",1
89,"know ballers it been blind I mean really to me","",1
89,"and this is this is I just think how","",1
89,"my parents did it but you know I was chosen to be blind","",1
89,"from the chosen one to be lived and I'm going to represent it the way that it is and what","",1
89,"it is is a way of life you know it's just that that's just how i","",1
89,"live from LA and I'm proud of who I am","",1
89,"and I use the blindness to my benefit. You know what","",1
89,"was given back to me is an era listen and an open heart","",1
89,"to you know let everything people it's about trust","",1
89,"and then to have the gift of music to give it is is","",1
89,"the trade off. So you know I had to","",1
89,"wear a low where well you know it's","",1
89,"it's not as I work for dialogue in the dark","",1
89,"which is which was here for two years. It's one hundred","",1
89,"twenty nine cities all over the world in the forty countries and what it","",1
89,"is is taking sighted people through. They","",1
89,"cower like we had six six","",1
89,"room gallery and they were all","",1
89,"like Central Park supermarket with subway","",1
89,". We have Times Square in there but you went through in total","",1
89,"darkness you couldn't see you can't even see no","",1
89,"shades Nothing says total darkness and the","",1
89,"people that are taking you through were blind or visually impaired","",1
89,". So when you go through their email you of course you know","",1
89,"you don't get a sense of of what it is to be","",1
89,"blind but you do get a sense of how black people are treated","",1
89,"because now that you're in there you you are really","",1
89,".","",1
89,"You're so wild and it's amazing and it gives this the blind person","",1
89,"who'll we have about fifteen and really an opportunity to","",1
89,"lead in their own environment and see the difference because not","",1
89,"worse. Over all over the place the gallery spaces","",1
89,"you stand for much. Still trying to take it one step at a time because you're free to do","",1
89,"it but then use as you as you get comfortable with then you start","",1
89,"relaxing and what I'm trying to do is get you to","",1
89,"understand forget us because after a while you know realize you can't use in the trite","",1
89,"and can't and there's just really hone in on the other senses.","",1
89,"It's called Dialogue in the dark and it's","",1
89,"it started in Germany and the biggest one right now is in Israel. Really we want","",1
89,"to know that we really do want it back. So again if anyone's listening","",1
89,"we really want to speculate is a tremendous tool to teach people","",1
89,"because once people finish going through there.","",1
89,"Their sense is wide open and bust wide open. You know there was snow and","",1
89,"everything. If we're feeling every hearing everything and then they","",1
89,"appreciated their eyesight that much more. There are forces that","",1
89,"are all told they were there because you had just because there was no","",1
89,"other choice but to use your other senses to feel your way through these guys","other choice but to use your other senses to feel your way through these guys",2
89,"you know.","you know.",2
89,"So when he came out in the end you know again appreciated the","",1
89,"power of the Web site is the beauty of what it is and","",1
89,"when she came in you came back when the lights come back on but","",1
89,"no I was it was tremendous it is your own out of the biggest one I think they get","",1
89,"because they get their public service workers cops firemen to","",1
89,"do this as a training tool. So intransitive makes a","",1
89,"much better to do. Well they know they're going to have a listen. Anyway I mean you know I'm sure they","",1
89,"have stuff now but you know you're going to recall situations where you don't have","",1
89,"the best caption dark so yes it's","",1
89,"you know and again it awakens the other senses. You know her and","",1
89,"you know different and military you know that in married there they're forced to","",1
89,"to use all of that stuff to stay alive for him.","",1
89,"Tell me something but growing up. Learning your way","",1
89,"around the. City went to school you know","",1
89,"and you know being extra inside kids you know.","",1
89,"But where did you go or school.","",1
89,"Well when I was so I started really.","",1
89,"I'm going to schools like two three years old nursery school and I was","",1
89,"in this thing called the juicier for the blind and so there I was","",1
89,"with blind people and I come home and I was in the projects with","",1
89,"far sighted people said a kid's side people say","",1
89,"kids but they were all of three four five two you know so","",1
89,"the blind thing at that time at home was","",1
89,"yes I was blind but they were so that kids were so used to","",1
89,"it so you know because we all grew up together","",1
89,"and and actually these","",1
89,"people these kids would be a part of my protection","",1
89,"because if anybody did mess with me or came in a neighborhood you know they have a back.","",1
89,"If we play baseball as we know the","",1
89,"play of course that bit a little bit and these are kids we're talking about","",1
89,"five six seven year old kids doing this on their own on their own. No I","",1
89,"don't. We just did it. They were in last","",1
89,"get. But I will always get a chance to play and I'm","",1
89,"wrestling fighting anything like that I was I was good at it.","",1
89,"So because that was physical contact and","",1
89,"they knew to fight play rough and they like that you know","",1
89,"so and I again my brother was six years old so he had his own","",1
89,"crowd but his own crowd would even look after me because that was","",1
89,"their friend's brother so so then the projects there I","",1
89,"had those people when I didn't realize that","",1
89,"until maybe I was five six years old and that I did the","",1
89,".","",1
89,"Medic school that were blind.","",1
89,"You know I got this kid with me to my house and","",1
89,". And then that was when I really learned that","",1
89,"there was different color skin. Now do you know that up until that","",1
89,"point it was one and and everyone started because","",1
89,"I mean him you know in school would always the challenge each other to","",1
89,"it because we love the box of Wheaties box we resolutely checkers because we have","",1
89,"that's how we that's how we roll with it with the best friends in there so","",1
89,"we started you know all my friends because I was I was","",1
89,"like oh by the same token I was embarrassed because.","",1
89,"Why do you say you know what did you understand. Cars","",1
89,"can you know that and I wouldn't want to you know you know my","",1
89,"attention then voices would feel people's","",1
89,"hair. For men with less isn't it","",1
89,". But you know then then I started realizing that","",1
89,"to even just a culture was different you know white","",1
89,"people did stuff different than black you know even and how it","",1
89,"played out. We talked with someone who is","",1
89,"so different I mean again","",1
89,"you know like it does seem like I. Would say to","",1
89,"white kids or. I can tell from","",1
89,"that. No because because I know I'm not going to","",1
89,"American explaining would do justice to.","",1
89,"The other side by trying to explain it but it was if it was just something","",1
89,"that you felt you know it was just something that you didn't know the","",1
89,"difference. You know and I have to say that one was wrong and one was right","",1
89,"and then I blamed him today you know and then I went to a camp six years ago","",1
89,"when all Jewish Care and. The","",1
89,"first week I got there and I cried like of the because it","",1
89,"was the first time being away I didn't know any of these kids. Plus i","",1
89,"Phone a lot really for the first time. These kids these are psyches","",1
89,"so I was out of my own you know new cabin new place I was","",1
89,"around things a lot. Only for the kids there with like you","",1
89,"know who's blind and you know I wasn't used to being treated like this I came from kids and","",1
89,"all you know so the first week or so","",1
89,"my mother sent the package of candy and stuff","",1
89,"and this one kid though it was the news that you can't because a","",1
89,"mother worked there. Jewish kid. Larry my school it's so Larry you know","",1
89,"and the guy was","",1
89,"you know he was a bully. His mother worked there and he stayed all","",1
89,"nine weeks. We only went to three trips over three weeks and it's true","",1
89,"but so but he went in there and I heard something","",1
89,"moving in my ear and","",1
89,"he was you know stealing from my package. Well","",1
89,"then all of a sudden the project ship came out down the side of the","",1
89,"back is missing. I","",1
89,"mean pretty. I didn't see","",1
89,"me. Probably so but then the whole bulk","",1
89,"of the rest of the time the soldiers treat me different","",1
89,"you know. Stop laughing with me that me and my games so the next two weeks of great","",1
89,"after that I went to camp ten years in a row and more blindfolds came","",1
89,"through at that time but I was. I was","",1
89,"the man in their care and. It was a beautiful thing and I was you know one of the","",1
89,"few blacks. Times so I had to deal","",1
89,"with but it was beautiful it was one of the best things that the","",1
89,"photo did you chance to serve","",1
89,"yourself. Right. Stand your ground. Right you know you","",1
89,"know changed my whole life I'm sure you know but how did your parents","",1
89,".","",1
89,"Do. Freezing","",1
89,". Raising a blind faith I think I think they","",1
89,"were true I would have when I you know Run Run","",1
89,"kids with their parents now I'm you know I can't be any more proud.","",1
89,"Do the be me I was forty zero five years","",1
89,"old they sent me to after the Jews few of them went to a Catholic nursery","",1
89,"school people and then.","",1
89,"They let me go downstairs by myself and play with the kids in","",1
89,"the whole neighborhood really watch out for each other so back","",1
89,"then it was you know it was it was it was easy to do it OK","",1
89,". We had everything near our home followed","",1
89,"by ski music to go","",1
89,"on holiday so.","",1
89,"And then you know as as a group it just they just","",1
89,"gave me enough space to learn","",1
89,"but structure so it was it was","",1
89,"tremendous. Never never see","",1
89,". Him.","",1
89,"Nothing could do something so. You","",1
89,"know sighted friends if if if if I got into fights","",1
89,"and and and it seemed like it was all well you know","",1
89,"she wasn't being so you know you live you know","",1
89,"your hero for the by the same token","",1
89,"big on education. I was in a school for the","",1
89,"first year. Six years old I think","",1
89,"it was a school of my neighborhood so they sent me here and they had these classes called","",1
89,"psych conservation and what it was was anybody with our","",1
89,"problems had a base class.","",1
89,"Then you go off to regular classes from nine to twelve and then you come back to this","",1
89,"class to learn","",1
89,"in this school. My mother came one day and there I was in the","",1
89,"class and then the player would think it was one of the kids learn to read","",1
89,"and she just happen to surprise surprise visit. And","",1
89,"the next day I was gone. School I remember I mean I don't","",1
89,"remember all of this and it's down","",1
89,"to P.S.A. and that's when they had the bro class and again this","",1
89,"was not really be with blood because all those other people could","",1
89,"see that you were really totally blind people really in the black","",1
89,"community who knew them and well so mother got me","",1
89,"out of here. Vang school and that was the beginning of","",1
89,". You know again children and she was just. Education","",1
89,"is her name and my father again was the most gracious.","",1
89,"Classy just guide everybody.","",1
89,"I mean he gave to the whole neighborhood to","",1
89,"parties you know it was crowded. Always family","",1
89,"always friends and people on my floor all the kids.","",1
89,"Every every Christmas somebody would get everyone to think I","",1
89,"was brilliant with children so he was","",1
89,"again probably a tie to my kids treated me so","",1
89,"well. But not being honest. You know there are","",1
89,"so you know how he won. So","",1
89,".","",1
89,"These are tremendous people and my whole family really both sides","",1
89,"fantasize from the West Indies a mother son from the south but","",1
89,"but throughout the family there was a disability something","",1
89,"whether you were that word. That this is","",1
89,"a disability but it was gay at the time I was like whoa you know","",1
89,"we weren't we didn't shy away from and we were proud you know really you know","",1
89,"even though you were my cousin. So I mean this is before before I was","",1
89,"working or it's not for you know all of it so you know","",1
89,"we have everything in the family. We had drop outs we're","",1
89,"college grads You know we have lawyers you know bombs","",1
89,"so you know but we all do get","",1
89,"together when it was family time and we all","",1
89,"share this stuff it wasn't you know so it wasn't a big thing you know","",1
89,"it just wasn't a big thing and I went to school and came","",1
89,"up and graduated from Pier Six this is be a six","",1
89,"year Navy sixty you know it can and that's kind","",1
89,"of pretty you know white school in that group. But","",1
89,"that was where the broke last was and when you left early we're going to go to","",1
89,"P.S. one hundred four because that's where they have the lying kids go.","",1
89,"Might be a part of my mother in law school so she said What do you","",1
89,". Think about going to the lines. She used to love that","",1
89,"and God knows that's because it's a Catholic school and then I","",1
89,"found out it was love about all this because I","",1
89,"never really saw you know saw or so through","",1
89,"somebody so I said you have a list of it and that","",1
89,"little guy from my camp and then it kind of it can't later who was","",1
89,"like who was already going there and we became friends","",1
89,". So I went there and","",1
89,"that was the first time that I got a chance to really","",1
89,"play and be on the same level as my peer. You have two","",1
89,"plays with the society. I think you have to adapt to the sighted world","",1
89,"every day I mean I have to worry about finding","",1
89,"work anymore because now I'm wrestling play and","",1
89,"jam and Dane blind people","",1
89,"and it was an unbelievable feeling to know him.","",1
89,"Pretty pretty popular you see us over there. So","",1
89,"yeah yeah but you know I have a lot of so different but this was different","",1
89,"because now I was comparing myself to what my people do","",1
89,"less black people. I wasn't around too many blind people to see what","",1
89,"other blind people do most of my friends say and the only people who were one","",1
89,"of the class and we will all have different great so","",1
89,". I learned to get on a school","",1
89,"bus. There will be a day but again you know you can","",1
89,"find but when you went to this little room and this was","",1
89,"the first of all no one's you know","",1
89,"was it kind of a welcoming thing because I grew up a","",1
89,"Catholic education here you know you're not really because it was a public school","",1
89,"but we had a church in our neighborhood so there. So did","",1
89,"its actions and all that great communion confirmation","",1
89,". So when you're growing up to learn from","",1
89,"other kids you know well I mean if kids can","",1
89,"if I went to a new place. Of course kids would try","",1
89,"to but. I'm you know again that's what","",1
89,"I'm happy to decide the world because","",1
89,"every day you have to adjust","",1
89,"to this other people's world I mean you know it's just the words you're","",1
89,"not doing it you know so and","",1
89,"so I that was definitely learning how to handle","",1
89,"the namecalling ribbing","",1
89,"fighting all of that stuff and how do you","",1
89,"get fused and again. Well that again","",1
89,"it comes back to the tax man and the base of it all you","",1
89,"know. They never.","",1
89,"They never. Told me to go out and start anything","",1
89,"or any fights like that but a very very bad. Ahead of that","",1
89,". If. You'd be teased like that you","",1
89,"know you just have to be ignored.","",1
89,"Work past it because eventually you know that you're going to show them that","",1
89,"you belong. So you know you just have as has had that feeling you know. But it","",1
89,"wasn't like I got approval ratings. So you know so somebody","",1
89,"teased you called evening recently called some back. You totally","",1
89,"ignore them you couldn't really write having to confront them physically right.","",1
89,"As if they were in the projects as they came through. Rob this is somebody who","",1
89,"is well then I can challenge of because I know","",1
89,"that my friends and I've you know I knew inside of my friends in the","",1
89,"neighborhood.","",1
89,"We're going to be around or be there to back me up","",1
89,"so I could be a little more assertive with the physical thing. They're not","",1
89,"school. B. Because I don't want to get a kind of a","",1
89,"mother because you know in school so I can say no","",1
89,"I just sat and you know my mother made sure I was dressed in religious schools","",1
89,"jacket and tie. One oh","",1
89,". Yeah. And now do you know","",1
89,"the phone just a variance dress so. She made sure","",1
89,"that I looked the part. Somebody","",1
89,"deserves to be treated with respect. You know and then when I","",1
