"transcript_id","original_text","guess_text","transcript_line_status_id"
143,"think I'm out of sequence but McCoy came","Um- I'm out of sequence, but uh McCoy came to",4
143,"to Paris","Paris with the ",4
143,"with the best. Musicians of the world would you","with the best musicians in the world and... you know",4
143,"know between shows I walked right up to him and said you know. Because this","between shows I walked right up to him and said ""you know, McCoy, this event had been",4
143,"is this event after we played a bit but that","this event after we played a little bit but that, that uh-",4
143,"the French national thing. And after we did.","Um- French national thing. And, uh after we'd uh-I spent ",4
143,"I spent the evening with the IS drummer at the time I ses.","I spend the evening with uh - his drummer at the time, Lewis Hayes um- I",4
143,"I walked right up to a class if you know because","I walked right up to McCoy, I said ""You know McCoy,  ",4
143,"I would like to play with you I'd like to work with you.","I would like to play with you- I'd like to work with you.""",4
143,"You know there's a few phrases in France I'm going to say","You know, th-there's a ph-uh-phrase in-in France, I'm not gonna say it",4
143,"it because it's a little gross","because it's a little gross but",4
143,"but basically you know.","but uh- basically, you know, they're here.",4
143,"They're here. You know instead of down there here you go and that's where","here [laughs]. You know, instead of down, they're here, you know, and that's where I was",4
143,"I was. And I welcome right up to live in the middle you know you don't","I was [chuckles] And I walked right up to him and you know, yeah, you know McCoy [laughs]",4
143,"because","[laughs]",4
143,"I'd like to work with you in. You","I'd like to work with you in- you know, um-",4
143,"know people I may have to and I'll take that for the listening.","Um- people [Barry]I may have to annotate that for the listening audience. [laughs] [Aaron]oh- [hearty laughter and clapping]",4
143,"I don't know what the you know people would come to tell them.","No, but uh- you know people would come to town um",4
143,"Would you show over come to town and I'd work with him I mean you know. So word had","Woody Shaw would come to town and I'd work with him, I mean, you know, so word had",4
143,"gotten to McCord anyway. You know that there was this guy friends above. Well.","gotten to McCoy anyway, you know, that there was this guy in France and ba ba ba ba ba. Well, um, it took",4
143,"It took that sucker the","it took- that took a little while",4
143,"while but McCoury to make oh. You know","but uh, McCoy gave me a call, you know you get",4
143,"you get that. I think we're all. Yeah. And it's like seriously","you get that [Barry that's great, yeah] that call. And it's like seriously, really, damn-[laughter]",4
143,"really. And it was very nice","Damn [laughter] And it was very nice because",4
143,"because a crook a sweat flew to London. And it was","uh- ok, so I flew to uh- London. And it was just",4
143,"just because I know in the studio we play for.","McCoy and I in the studio we played for-",4
143,"I guess about an hour and a half. Something like","I guess about an hour and a half. Something like that",4
143,"that in fact I was playing with someone and not that I remember the night before.","in fact I was playing with someone and-and now that I remember - the night before in Leone",4
143,"In Leone. The middle of friends. And I flew from my own to.","In Leone, in the middle of France, and I flew from Leone to uh-",4
143,"You know OK. Anyway. You know. It was like that that was the audition","You know, OK, anyway um- you know, It was like, that-that was the audition",4
143,"and it was done.","and it was done. And then-",4
143,"And then that is no more to talk about that. I mean.","And then-then that's it- no more to talk about that. I mean um, ",4
143,"The first year we played a bunch. The next fourteen thirteen","first year we played a bunch. The next fourteen, thirteen years",4
143,"years we played a bunch","we played a bunch",4
143,"more. Now but that was all around","bunch more [both laugh] Now- [Barry]but that was, that was all around the world",4
143,"the world. Yeah.","Yeah, yeah, yeah, yeah, of course",4
143,"Of course. I mean. No You know like I said I don't like","Of course, I mean, no, you know, like I said I-I don't like to",4
143,"to talk about these things but you know I played in the","talk about these things but, you know I played in- the greatest",4
143,"greatest hours a night in the","halls in the-in the world, I have",4
143,"world of two thousand. You know.","I have uh- two thousands, you know, and I played",4
143,"And I play. Two teams. You know I mean I'm not going to say","play two tens, [laughter] [Barry- Right] you know, I mean, I'm not gonna say it was",4
143,"it was always you know thousands and thousands but you know him.","it was always, you know, thousands and thousands, but, you know, and, um, I'd like.",4
143,"I do like the intimate setting a sort of like a","I'd like the intimate setting and I also like the large",4
143,"large setting. I'll do or. I like playing outdoors","setting, um, outdoor, I like playing outdoors because ",4
143,"because then you can. I try to play to the. The person in the back of the room.","then you can - I try to play to the-the person in the back of the room, however",4
143,"Over for that is sort of a quarter of a mile","far that is so if -you know [both laugh] you're a quarter of a mile away",4
143,"away I want to try to play to them. You know.","I want to try to play to them, you know, but um",4
143,"But","um- [long pause] Yeah",4
143,"you know. That was that was pretty much what I what I did you know.","Yeah that was, that was- pretty much what I, what I did, you know.",4
143,"You know how does how does this relate to windward OK so a living in what","Now how does, how does this relate to Inwood? OK, so I've been living in Inwood these",4
143,"these years since","years uh, since",4
143,"nothing more than I said before nine hundred ninety nine hundred ninety there","19- what did I say before? 1990 [Barry] yeah. [Aaron] 1990 ",4
143,"RIGHT RIGHT RIGHT RIGHT. Legend idea moved in would of Riverside.","RIGHT RIGHT RIGHT RIGHT. RIGHT [Clears throat]. 1990 I moved to Inwood uh, Riverside and.",4
143,"And then shot. Yes. What.","Henshaw um- [Barry hesitates] [Aaron] yes? [Barry]What-what decided",4
143,"What decided you wanted what. At that","what decided you on Inwood- at that point?",4
143,"point. Sublet apartment. The availability of","Sublet apartment. [Barry] The availability of the apartment. [Aaron] Right",4
143,"the apartment. That was it. Yeah. You know I didn't. You know","That was it. [Barry]Yeah. [Aaron]You know, I-I'd been, you know I-I",4
143,"I bury I try to commute from Paris","I-I- [chuckle] Barry, I tried to commute from Paris for you- [Barry laughs]",4
143,"for","[Laughter]",4
143,"you. Yeah that","[Laughter and clap] [Barry]Yeah that wouldn't have [Aaron] I did- ",4
143,"well. I did","I did [Laughter] I did you know, I",4
143,"you know I really did for a year I was on the plane with fled. Go back","you know I really did for a year I was on the plane with [?]. Go back to France ",4
143,"to Fred. But it was a bit","yeah, um, but um, it was a bit much",4
143,"much and you know I decided to OK. So I guess it's time","and, and uh- you know I decided to OK, well I guess it's time to",4
143,"to come back stateside.","come back stateside... [long pause] But uh,",4
143,"But","But uh, oh!",4
143,"oh are you kidding me the food the culture I mean everything. Every now","oh, are you kidding me- the food, the culture, I mean everything, every- na",4
143,"and it's","it's interesting",4
143,"interesting that I might trip. Some touchy waters here","now I might tread some touchy waters here but, um",4
143,"but you know.","um- you know um- the quality",4
143,"The quality of life. For example.","the quality of life, for example, um... [long pause] the ",4
143,"The","awareness",4
143,"awareness of a population. Pathetically or whatever.","of a population, politically or whatever, I mean",4
143,"I mean. I realized when I was in Kranz. You know they","I mean, I realized when I was in France, you know, they have uh",4
143,"have their political system","uh- their political system is",4
143,"is completely","completely left",4
143,"left to completely right. And everything in between.","to completely right and everything in between. We just",4
143,"We just have like writing more right. I mean we have","We just have, like, right and more right. That's all we have here. [Barry: yeah]",4
143,"to you know. But everything in","you know, but, everything in between",4
143,"between completely left to completely right. And I was fascinated","completely left to completely right. And I was fascinated because",4
143,"because you know it. I had never known anything like","Because you know It-it, I- I'd never known anything like that",4
143,"that and everyone","and everyone in",4
143,"in the street. Understood what was going on politically. It was none of this.","the street understood what was going on politically. It was none of this, uh,",4
143,"You know someone would say something on television and you go oh. Since it's on","You know someone would say something on television and you go ""oh. Since it's on television ",4
143,"television it must be true.","it must be true."" [Aaron laughs] you know",4
143,"You know like it's done over here. Yeah.","You know, like it's done over here. [Barry: Yeah] But uh",4
143,"But","But uh- um-",4
143,"I mean not. Not just that but many many many other things that you just don't","I mean not-not just that but many many many other things that you just don't find here",4
143,"find many many other things. Now yes they have","find here - many many other things. Now yes they have problems",4
143,"problems every. Less. There are people. You have problems. Yeah.","problems. Every-every place- There are people, you have problems. [Barry] Yeah.",4
143,"You know. But they were","You know. But um- there were just",4
143,"just so many revelations.","just... so many revelations.",4
143,"The Mona Lisa. For","The Mona Lisa. For example",4
143,"example. Oh that. That hurt the most the Mona Lisa that would that would","example. Ohhh that-that hurt the most, the Mona Lisa, that one-that one hurt the",4
143,"hurt the most. Because you know. I'd love all kinds of love","hurt the most. Because, you know, I love all kinds of art, I love art",4
143,"or any type of art I really love. Well.","or any type of art I really love. Well...",4
143,"I'll have to clarify that some day","I'll have to clarify that some day, I'm sure",4
143,"I'm sure. I","I'm sure [Aaron laughs] [Barry: Okay] But",4
143,"But you know. So you. You're going through your studies and you're","But you know. So you-you're going through your studies and you're looking at all",4
143,"looking at August. Fabulous work by having people. You know. And you finally get a chance","looking at all this fabulous work by other people, you know. And you finally get a chance to see",4
143,"to see","to see it",4
143,"it right in front of you thinks. No nonsense you know.","it... right in front of your face. [Barry: Right] No nonsense, you know. Here it is.",4
143,"Here it is depth and.","Here it is, right? [Barry: Yup] and uh- you know",4
143,"You know","You know, you go to the",4
143,"to have this great anticipation because you're","to the Louvre and- you're- have this great anticipation because you're gonna",4
143,"going to see this country. Working there signs Mona Lisa arrows you","gonna to see this great work he le- signs, Mona Lisa, arrows, you know",4
143,"know how. Then it takes about. I don't know","know. Oh man, it takes about, I don't know",4
143,"some minutes several minutes to get there. You finally get it is a crowd of thirty people or","some minutes, several minutes to get there. You finally get there there's a crowd of thirty people or so",4
143,"so yeah. And you have to review way to the front","so [Barry: yeah] . And you have to- weave your way to the front and",4
143,"and I get there. And I'm","and I get there [chuckle] And I'm like",4
143,"like wait wait. It was","like... wait wait. It was like",4
143,"like only this big. And I've always thought it was this huge seven little bit","like only this big [laugh] And I've always thought it was this huge tableau that, you know",4
143,"you know. Resisted like and. Wow.","you know. You would just sit back and, wow, and it's only this big [Both laugh] I was floored [Laughter continues] I couldn't",4
143,"I","I couldn't believe it",4
143,"think","believe it",4
143,"it's","also",4
143,"also there you go. Reality is you know better than fiction I guess. At","also there you go. Reality is, you know, better than fiction I guess, right? At least ",4
143,"least straighten you out. But how does this you really lead to him with OK","least it straightens you out. But uh- how does this re-relate to Inwood, OK so",4
143,"so my team and yes.","so 1990-yes um...um... pretty much",4
143,"Pretty","Pretty much",4
143,"much I was still and it out. You know. We were busy","much I was still in and out. You know, we were busy for",4
143,"for","for",4
143,"a Navman and a half months a year. Yeah. So I was in and I don't.","8 and a half, 9 and a half months a year. [Barry]Yeah. So I was in and out um- When I moved",4
143,"When I moved here to protest. He sed.","When I moved here to Park Terrace East, that's ",4
143,"That's when I recognized Mr Meadows and the garden and everything and","That's when I recognized Mr. Meadows and the garden and everything and that's",4
143,"that's when I started to become involved in but.","that's when I started to become involved in that um- you don't",4
143,"You","You don't",4
143,"don't mind if I don't talk about awards and stuff like that you talk about what you want to talk about.","don't mind if I don't talk about awards and stuff like that, do you? [Barry:Talk about what you wanna talk about] No I-I-I don't",4
143,"I don't have to talk about it but.","I don't have to talk about it but um- um... I found",4
143,"I","I found it",4
143,"found it just so cool that. There was a person like Mr Ramos. In","found it just so cool that-that uh there was a person like Mr Reynolds in the neighborhood",4
143,"the neighborhood. Now. Especially for me because they're not that many black men.","the neighborhood. Now, Especially for me because they're not that many black men...uh- of his",4
143,"Of his","Of his stature",4
143,"stature. In the neighborhood. Yeah I can say.","stature...uh- In the neighborhood [Barry: Yeah] that I can say, so",4
143,"So it was kind of personal because we had that I","So it was kind of personal because we had",4
143,"think with what if the disk. Every city area. I mean we could","what ethnicity-eth-ethnicity are you I mean we could share",4
143,"share things because we had a common culture. I mean if and if it had.","share things because we had a common culture. I mean, ethnicity that's funny",4
143,"It's funny","funny, but um-",4
143,"but. So. So I see.","but um- So-so I- he- you know",4
143,"You know I've always been the baby.","You know I've always been the baby",4
143,"And it didn't. Most of","In uh most of the",4
143,"the settings where there are people I'm always the youngest.","the-the settings where there are people I'm always the youngest [Barry: Ah] Um, um",4
143,"Even the groups that I played of I was the youngest mostly.","Even the groups that I played in I was the youngest mostly except for the",4
143,"Except for the French bad because we're all about the same","Except for the French band because we're all about the same age",4
143,"age. The National Orchestra. Jest","The National Orchestra. Jest",4
143,"of. So","Um... Um so it was",4
143,"it was just normal for me to see","it was just normal for me to see",4
143,"him. And for heat for him to see maybe. Because I","him. And for he- for him to see me because I",4
143,"that older younger relationship was easy for me. Yeah. It was very","that older-younger relationship was easy for me. [Barry:Yeah] It was very easy",4
143,"easy and. He was doing such incredible things I had. And","easy and he was doing such incredible things I had",4
143,"that the longer I knew him the more Mason became by him","the longer I-I knew him the more amazed I became by him because",4
143,"because I mean people don't think about if I'm pointing over here","because, I mean, people don't think about if I'm pointing over here",4
143,"I'm pointing to outside now. To the Glad to the no to the park. To talk","I'm pointing to- outside now. [Barry: To the garden?] To the-no to the park. [Barry: To the park]",4
143,"to the particles of the poor people. You know they look at","to the park, the gardens over here, the park. People, you know, they look at Bruce's ",4
143,"Bruce's garden may think that's the crowning achievement of all of his"," garden and think that's the crowning achievement of all of his work",4
143,"work. Forty five years. You know. Plus he's been","work. Forty five years, you know, um, plus he's been doing",4
143,"doing this. That's like half of his life half of the man's life he's","doing this. That's like half of his life, half of the man's life he's been",4
143,"been beautifying. The neighborhood. I mean think of what he's done.","been beautifying the neighborhood. I mean think of what he's done, you know,",4
143,"You know. I mean at the time when he came there were gangs here. You know. Of.","You know, I mean at the time when he came there were gangs here. [Barry: Yep] Um... he convinced",4
143,"He","He convinced the gangs",4
143,"convinced the gangs to help. He convince the gangs to."," the gangs to help him. He convince the gangs to you know",4
143,"You know do better with this their lives. You know","You know do better with this theirs- their lives, you know, he",4
143,"he the and other","he um- and other-other",4
143,"other civic groups. Combined are responsible for.","other civic groups uh combined are responsible for why",4
143,"Why I should park looks the way it does today. You know.","Why [?] park looks the way it does today, you know, he",4
143,"He is responsible for the Green Streets. He and his wife.","He is responsible for the Green Streets. He and his wife",4
143,"Of course I was possible for cleaning up the Bruce's garden. I mean Bruce's garden was","Of course I was responsible for cleaning up the Bruce's garden. I mean Bruce's garden was probably",4
143,"probably or the area Briscoe's probably the","or the area Bruce's garden was probably the worst",4
143,"worst of the.","worst of the um",4
143,"Negligence. Because the neighborhood. Sort of pitched","Negligence because the neighborhood sort of pitched in",4
143,"in and everything they pitched it everything he was a dump.","in and everything they pitched in everything [laugh] [Barry: it was a dump] Yeah, it was a dump",4
143,"It","It was",4
143,"was adopted was a dump Yeah. But the park was also neglected.","it was a dump, it was a dump, yeah. But the park was also neglected because",4
143,"Because the gangs just trashed it so hard. The you know they would put him. They"," the gangs just trashed it so hard. The-the, you know, they would put in-they would replace",4
143,"would replace the benches that would burn down and they would be burned out again so the.","would replace the benches that were burned down and they would be burned out again so the park",4
143,"Park surprisingly like they don't know what to do with this. But Mr knows another.","Park department was like they don't know what to do with this. But Mr [?] knows another.",4
143,"You know like my Civic communities got together and it was.","You know liked-mind Civic communities got together and voila",4
143,"We have what we have now.","We have what we have now. Um-",4
143,"And there are many more things many many more things. Not much of","And there are many more things many, many more things. Not much of",4
143,"this is being talked about. If any. They talk about","this is being talked about. If any, they talk about Bruce's",4
143,"Bruce's garden.","Bruce's garden. Which is",4
143,"Which is beautiful don't get me wrong right. If you proof of God is beautiful. But there's","Which is beautiful don't get me wrong [Barry: right] Bruce's garden is beautiful. But there's so",4
143,"so much more to it and it all of I should","so much more to it, I mean it's all of [?] park",4
143,"park. The memorial garden the moral slope on the site the gang culture eat.","Um- The memorial garden the memorial slope on the side, the [gankle] tree",4
143,"The people you know I want to point we had a chance in flipping in the underbrush.","The people, you know, at one point we had a [?] living in the underbush.",4
143,"On the Broadway. Quarter. You know","On the Broadway uh Quarter, um, you know",4
143,"I mean it's","I mean it-it's",4
143,"just not being talked","just... not being talked",4
143,"about and. I find that a bit disturbing. I hope it's not just because","about and that- I-I find that a bit disturbing. I hope it's not just because",4
143,"he's black. You know. I find it disturbing.","he's black, you know. I find that disturbing because",4
143,"Because some other groups of coming. In the","Because some other groups have come in, uh, in the meanwhile",4
143,"meanwhile that","that",4
143,"it's you know they haven't spent very much time. And everyone talks about what","haven't you know they haven't spent very much time. And everyone talks about what",4
143,"they do. But it doesn't even","they do. But it doesn't even pale",4
143,"pale to the scope of what Mr Milosevic I mean stand.","pale to the scope of what Mr Milo and his family has done [Barry: yeah] you know",4
143,"You know that test. That's a little disappointing I have to say. I guess","You know. That's-that's-that's a little disappointing I have to say. I guess it's",4
143,"it's just me. He just says where we are.","just, you know, it just says where we are. Um- but ",4
143,"But anyway how does that relate to me","But anyway how does that relate to me, I",4
143,"I. You know","I um- you know I've",4
143,"I've always loved.","I've always loved nature",4
143,"Nature that. I mean I grew up in a city but you could plug","Nature that- I'm-I grew up in the city but you could plop me anywhere",4
143,"me anywhere. Basically. Even a desert. If you'd","me anywhere, basically. Even a desert, if you've given",4
143,"given the proper equipment. I don't just want to turn to","given the proper equipment. I don't just want to turn to a piece of",4
143,"people.","piece of toast [hearty laugh] But",4
143,"But you know I don't I","But uh you know I-I could",4
143,"could be in the desert for little while or or the mountains or anywhere.","be in a desert for little while or-or the mountains or anywhere. Um- I-I",4
143,"I just enjoy nature. I enjoy the planet. I love the place.","I just enjoy nature. I-I enjoy the planet. I love the planet.",4
143,"You know this is the only home I know.","You know, this is the only home I know.",4
143,"Yeah. Now. The","[Barry: Yeah... Yup] It's the only",4
143,"only home I know. And if you know","only home I know. Um- and eh you know",4
143,"it's it's too bad it's really too bad that most","it's a- it's too bad it's really too bad that-that most",4
143,"of us don't get to travel and see different things to see how different.","of us don't get to travel and see different things, to see how different um people",4
143,"People live in different areas of the planet.","People live in different areas of the planet, you know",4
143,"You know it's it's really too bad because it's such a such a learning experience.","You know it's-it's really too bad because it's such a such a learning experience.",4
143,"It really is.","It really is um because",4
143,"Because yes I've been called on over the world. I mean I haven't played everywhere. I mean","Because yes I've been all-all over the world. I mean I haven't played everywhere. I mean it's a big",4
143,"it's a big planet. That I've I've covered quite a bit.","it's a big planet, you know. But I've-I've covered quite a bit um and",4
143,"And unfortunately like. You know as as I said before. When you're out","unfortunately like, you know, as-as I said before, when you're out",4
143,"there for","there for six",4
143,"six weeks a month. You don't have a lot of time","six weeks a month you don't have a lot of time to",4
143,"to stop and look around. So what do you do when","to stop and look around. So what do you do when you get to",4
143,"you get to airports. You observe other people you know. People walk","you get to airports; you observe other pe- you know, people walk",4
143,"differently in different parts of the world. You know that they hold themselves differently they carry","differently in different parts of the world. You know, they-they hold themselves differently, they carry",4
143,"themselves","themselves",4
143,"differently. And the foods and you know everything.","differently um and the foods and, you know, everything uh",4
143,"And when you do have a time to stop and relax for a few days. Then sure","And when you do have the time to stop and relax for a few days, then sure",4
143,"you just take it all in but. But travel. It's just indispensable.","you just take it all in but-but travel, oh,it's just indispensable.",4
143,"And it's unfortunate that more people thought OK. Back to the story.","]And it's unfortunate that more people don't. OK. Back to the story.",4
143,"So","So um",4
143,"as of. As my fourteen year tenure. Came to a close.","as I uh as my fourteen year tenure came to a close with McCoy",4
143,"Because I started working. I start. Music program"," I started working-I started a music program in",4
