"transcript_id","original_text","guess_text","transcript_line_status_id"
478,"So. So good memories of being in the park.","so good memories of being in the park. Um. There",2
478,"There used to","used to be, um,",2
478,"be where the fancy little deli is","uh, where the fancy little deli is across",2
478,"across the street there used to be a little coffee joint.","the street, there used to be, uh, a little coffee joint that",2
478,"That you could go in and get coffee. For fifty","you could go in and get coffee for 50 cents.",2
478,"cents. Or you could give him a dollar and the next day.","Or you could give him a dollar the next day, um, or",2
478,"Or whatever and. It was caught. Effie with hot milk.","whatever. And it was coffee with hot milk. And, um,",2
478,"And so we go there a lot.","so I would go over there a lot. And",2
478,"And it gave me two things A gave me coffee and a gimme somebody to talk to.","it gave me two things. It gave me coffee and it gave me somebody to talk to. Um. When",2
478,"When I moved here the woman","I moved here the woman upstairs,",2
478,"upstairs. Might be somebody you meet she. She's.","might be somebody you meet. She, she's, I'm",2
478,"I'm sixty six I'll be sixty seven she's seventy","66. I'll be 67. She's 75 and",2
478,"five and. She tells the story that she was conceived in this building.","she tells the story that she was conceived in this building, so,",2
478,"So. And that her grandmother was in this","um, and that her grandmother lived in this building.",2
478,"building. But she's the one who told me to come here. So. And today","But she's the one who told me to come here, so, and today",2
478,"we're still","we're still friends.",2
478,"friends. The men who live next door to me. His family was from","The man who lives next door to me, his family was from Harlem",2
478,"Harlem and. We're friends.","and, um, we're friends, um,",2
478,"Through Donny Bristow of the. Man I was married to we're OK So there's some history there","through Donny Bristow, the man I was married to. Well-we ok, so there's some history there but",2
478,"but. So he's here.","so he's here, and um.",2
478,"And yes so those are the people on this. On this floor have been the","Yeah, so they're, the people on this, on this floor have been the same",2
478,"same people that were here","people that were here since,",2
478,"since. Since I moved here. Just two places I used to go out or spent a","since I moved here. So that's 2 places I used to go. I also spent, uh, a",2
478,"lot of time. At the Harlem why.","lot of time at the Harlem Y.",2
478,"It's a different place now it's it's it's it's a little she she now is a little pricey.","It's a different place now. It's, it's, it's, uh, it's a little chi-chi now, it's a little pricey, got a",2
478,"A lot of equipment. But it was always a safe haven.","a lot of equipment. But it was always a safe haven. The",2
478,"But why was always a safe place to go and hang out and sort of a gym rat.","Y was always a safe place to go and hang out. I'm sort of a gym rat, always",2
478,"Always have","have been.",2
478,"been and. That was a great place. And then there were a lot of","And, um, that was a great place. And then there were a lot of joints",2
478,"joint to go to why go","to go to, like, uh",2
478,"out. Where you can get chicken and waffles all","where you could get chicken and waffles all night.",2
478,"night. And they were safe places to go.","Um. And they were safe places to go. Um. They've",2
478,"They've been replaced by. Places it sells chicken.","been replaced by, uh, places that sell chicken, um, primarily, um,",2
478,"Primarily","Chinese",2
478,"Chinese food and chicken. And they hand you the chicken through plastic","uh, food and chicken. And they hand you the chicken through plastic doors.",2
478,"doors. So it is my story that if somebody can't.","So it is my story that if somebody can't hand me",2
478,"Hand me my change and look and touch me. They can fix level.","my change and look and touch me, they can't fix my food. Nor",2
478,"Nor can they sell me food. So there's a prolific geisha. For. Of agape. Elation of of","can they sell me food. So there's a prolification, prolifica-lation of, of those",2
478,"those","things.",2
478,"things. But that's that's two places.","But that's, that's 2 places. And ",2
478,"And then the Muslims used to have a really nice restaurant not far from the temple. On","then the Muslims used to have a really nice restaurant not far from the temple on 116th",2
478,"hundred sixteenth","Street.",2
478,"Street and. I would go in there and","And, um, uh, I would go in there and eat.",2
478,"eat. And because of their faith tradition I wouldn't dress","Um. And because of their faith, tradition I wouldn't dress like",2
478,"like this. I don't cover. I mean I have covered when I've been in the Middle East. With","this. I don't cover. I mean, I have covered when I've been in the Middle East with friends who",2
478,"friends who","tour",2
478,"are who study Islam or. And who are Muslims there. But here I don't.","uh, who study Islam or, and who are Muslims there. But here I don't. But",2
478,"But if I go into a place. Here that I","if I go into a place here that I know,",2
478,"know. It is a jewish tradition of the women to","um, it is the tradition, tradition of the women to ",2
478,"wear dresses and cover I do. So that's a long story here used to go there in","wear dresses and cover, I do. So that's the long story of how I used to go their, their",2
478,"their place","place ",2
478,"and eat good food. Take you forever to get it.","and eat good food. Take you forever to get it because",2
478,"Because things move slowly. So if you were ordering","things move slowly. So if you were ordering something",2
478,"something they were actually going to go back in the kitchen and cook it it was a like it was cooked","uh, they were actually going to go back in the kitchen and cook it. It wasn't like it was cooked",2
478,"and they had heated up or. Finished cooking it they were going to go back and cook it. So","and they had to heat it up or finish cooking it. They were going to go back and cook it. So you",2
478,"you couldn't be too hungry when you went in","couldn't be too hungry when you went in there.",2
478,"there was no phrase I used to use to live they go in","So that's another place. I used to, used to love to go in there",2
478,"there and eat.","and, um, and eat, um, and",2
478,"And just listen to the","just listen to the conversations",2
478,"conversations that were. Or inside there.","that were, uh, or inside there. Uh, I",2
478,"I belong to the church. I did I don't anymore that's right over here one hundred sixteenth Street.","belonged to the church - I did, I don't anymore - that's right over here on 116th Street. Um, Canaan",2
478,"Canaan Baptist Church in white T. Walker was or who was an ally of Martin Luther King and","Baptist Church and Wyatt T. Walker was there, who was an ally of Martin Luther King and I",2
478,"I spent a lot of time in that","spent a lot of time in that church.",2
478,"church. And it was a. It was","And it was, um, it was a",2
478,"a leader in social justice in this community. And in this","leader in social justice in this community and in this country,",2
478,"country and. Under his. Is leadership so I followed him around the world.","and, uh, under his, his leadership so I followed him around the world and",2
478,"And I spent a lot of time over there.","I spent a lot of time over there. You",2
478,"You know I didn't really go far in Harlem. You know my.","know, I didn't really go far in Harlem. You know, my, uh, my",2
478,"My community in Harlem probably doesn't go much. Above one hundred thirty Eastern.","community in Harlem probably doesn't go much above 138th Street. And",2
478,"And it doesn't go much. Below one hundred ten street. It does now. But when I first came here.","it doesn't go much below 110th Street. It does now. But when I first came here, that's",2
478,"That's pretty much. That circle. And then east. Over to what used","pretty much that circle. And then, uh, east over to what used",2
478,"to be called Spanish Harlem which I'm not sure what it is anymore.","to be called Spanish Harlem, which I'm not sure what it is anymore. And",2
478,"And then over to the park. And it wasn't until","then over to the park. Um. And it wasn't until years",2
478,"years after I would hear the pond Broadway and I walked through the park from Columbia that I realize how","after I was here, I was up on Broadway, and I walked through the park from Columbia that I realized how close",2
478,"close we were to Columbia University.","we were to Columbia University. Like",2
478,"Like it was a park away.","it was a park away. That",2
478,"That were totally invisible me when I moved here.","was totally invisible to me when I moved here, totally",2
478,"Totally invisible and. Unlike today. You would not find anybody from the school hanging over here.","invisible. And unlike today, you would not find anybody from the school hanging out over here. Yeah. So",2
478,"So those were some of the places I would","those were some of the places I would go. Um.",2
478,"go back in the day I would go to Sylvia's I don't anymore.","Back in the day I would go to Sylvia's. I don't anymore. She",2
478,"She was alive","was alive then ",2
478,"then and the service was different.","and, um, the service was different. Um. -- Sylvia's is a? ",2
478,"Is a. It's a. It's a black restaurant it is kind of. The tourist place here now.","Is a, it's a, it's a black restaurant. It, it is kind of the tourist place here now. Syvli-yeah. And",2
478,"And years ago the woman who ran it or name was Sylvia.","years ago the woman who ran it, her name was Sylvia. And",2
478,"And I think is now either her grandchildren or her children one. And it's. She's got like two or","I think it's now either her grandchildren or her children run it. And it's, she's got, like, 2 or 3",2
478,"three places now all of them watch you when I have a walk or the family","places now, all in a block. She owns like a half a block or the family does.",2
478,"does. And when I used to go there it","And when I used to go there it was",2
478,"was. She was alive. She was cooking. She was in there.","um, she was alive, she was cooking, she was in there. And",2
478,"And it was different. And if you wanted something a little different.","it was different. And, um, if you wanted something a little different you",2
478,"You can do it. A little different. And it would happen. And then there was a place that by the why and leave","could do it a little different. And it would happen. And then there was a place up by the Y.  I'd leave the ",2
478,"the why I call pan pan.","Y, called Pan Pan's that, um,",2
478,"That was one of the few places that I could get a green salad.","was one of the few places that I could get a green salad ",2
478,"In this neighborhood. I were having to","in this neighborhood. I remember having to go",2
478,"go shopping for vegetables.","shopping for vegetables, uh, when",2
478,"When I leave work I used to work in the financial district known. Your house","I'd leave work. I used to work in the financial district down on, near Houston.",2
478,"and and. So I have to go","And, um, so I'd have to go get",2
478,"get. Tomatoes or anything that I was going to eat. That","tomatoes, let-anything that I was going to eat that was",2
478,"was vegetable that was fresh.","vegetable that was fresh. ",2
478,"I'd have to get in there and bring it here and.","I'd have to get it there and bring it here. And very",2
478,"Very few of the. Let me just run into joints.","few of the, like, just run into joints, had",2
478,"Had that kind of","that kind of food.",2
478,"food. But pain fans would make a chicken salad. I mean","Um. But Pan Pan's would make a chicken salad, I mean a",2
478,"a green salad with grilled chicken on it.","green salad with grilled chicken on it. It's",2
478,"It's ironic. You know what happen to pin pins Probably not.","ironic. Do you know what happen to Pan Pan's? Probably not. What",2
478,"What they say is it burnt down because of a refire. I believe that. Like I believe.","they say is it burnt down because of a grease fire. I believe that like I believe you're",2
478,"You're my sister. It. These","my sister. It, these people had",2
478,"people been Brian Griese for years now while the sudden when they had been asked to sell.","been frying grease for years. Now why all of a sudden, when they had been asked to sell and",2
478,"And when they had been","when they had been asked",2
478,"asked to leave. Why the burn down from a grease","to leave, why the burn down from a grease fire?",2
478,"fire. And at a time when nobody was around was a great height when nobody's around.","And at a time when nobody was around. So why is the grease hot when nobody's around?",2
478,"I mean just it smelled in a lot of that started happening around","I mean it just, it smelled and a lot of that started happening around here,",2
478,"here. Where there were fires that started","where there were fires that started happening,",2
478,"happening. Different kind of","um, different kind of building",2
478,"building. Happenings you know","mmm, happenings, you know, fires,",2
478,"fires floors falling in.","floors falling in right",2
478,"Right at the same time. That there was a whole. Onslaught of folks coming","at the same time that there was a whole onslaught of folks coming here",2
478,"here trying to buy property.","trying to buy property. And, um.",2
478,"And yet. I","Yeah. I, I believe",2
478,"believe. As I sit here","as I sit here that",2
478,"that. A lot of that was intentional and. And that it was.","a lot of that was intentional and, and that it was to",2
478,"To get the price you know you had people holding","get the price. You know, you had people holding out",2
478,"out. And like pain pains and they didn't. And then there was another place on one","and, like Pan Pan's and they didn't. And then there was another place on ",2
478,"hundred twenty fifth.","125th near",2
478,"Near St Nicholas across from","St. Nicholas across from the",2
478,"the rear. Right near the fire station that used to sell chicken.","rear-right near the fire station that used to sell chicken. Not",2
478,"Him an M M N M.","M and M, greasy ",2
478,"Reading chicken fried chicken. You know when there were the bars.","chicken, greasy chicken. You know, and then there were the bars, the",2
478,"Sportsman I think you know I don't drink anymore","Sportsman I think. But I don't drink anymore but",2
478,"but you do have music. Go in there and listen to music. Yeah.","it used to have music. You could go in there and listen to music. Um. Yeah.",2
478,"I don't see a lot of that anymore. You know I talk about jazz coming. To Harlem Well I you","I don't see a lot of that anymore. You know, they talk about jazz coming to Harlem. Well I, you know,",2
478,"know. It was already here. Deep.","It was already here. Deep.",2
478,"You know.","You know. -- You mentioned that in a lot of the [Background noise]. -- Ooh.",2
478,"Oh oh I forgot it was there.","Oh, I forgot that was there. -- Yeah, uh, a lot of the stories and places you would go to, like, safety is a theme that I heard a lot -- Yeah. --  that safe places",2
478,"Yeah","that you could go, -- Yeah. -- go to. Could you talk a little bit about like, what",2
478,"yeah.","was and what wasn't safe about the neighborhood? -- Uh, that's interest-yeah. --",2
478,"Yeah.","So, like. -- Well,",2
478,"Well","Put",2
478,"put in the context that I came here because somebody was trying to kill me.","it in the context that I came here because somebody was trying to kill me.",2
478,"So we start with that. And that this was his.","So we start with that. And that this was his,",2
478,"As a child he grew up in","as a child he grew up in Harlem.",2
478,"Harlem. And as a child because his uncle was Sugar Ray Robinson this","And as a child, because his uncle was Sugar Ray Robinson, this was",2
478,"was very much. His place to","very much his place, too, even",2
478,"even though","though",2
478,"he did very well financially moved to","did very well financially and moved to Riverdale.",2
478,"Riverdale but the safety I sought. Wasn't just","But the safety I sought wasn't just that.",2
478,"that. Because by the time I moved here I","Because by the time I moved here I had,",2
478,"had. From the safe hours I had developed a persona that said.","um, from the safe house I had developed a persona that said,",2
478,"If I run now I'm going to run the rest of my life and I decide it was a one in from him. And one from","""If I run now I'm going to be running the rest of my life. And I decided I wasn't running from him. Hadn't run from a",2
478,"a lot other than the one from him.","lot of other things, I wasn't going to run from him. But",2
478,"But the safety","the safety was",2
478,"was. None of the places that I described.","um, none of the places that I described had",2
478,"Had anything going on that was","anything going on that was sleazy,",2
478,"sleazy illegal. No drugs no eleven. People didn't bother.","illegal. No drugs, no nothing. People didn't bother you. Um,",2
478,"People grieve. You're welcome there.","people greeted you. Uh, you were welcome there. Um. There",2
478,"There was a sense of community.","was a sense of community.",2
478,"I felt like those were my tribe my people my","I felt like those were my tribe, my people, my tribe.",2
478,"tribe. And safety was. Was an issue you","And safety was, was an issue. You",2
478,"know. You know I speak about it romantically. And there was stuff going on in Harlem.","know. You know I speak about it romantically. And there was stuff going on in Harlem. What",2
478,"What distresses me is that there's still stuff on Harlem. It just got different names.","distresses me is that there is still stuff going on in Harlem. It's just got different names.",2
478,"You know it used to be called.","You know, it used to be called cocaine",2
478,"Cocaine and crack. And now it's.","and crack. And now it's, uh,",2
478,"It's ecstasy and. All the other designer drugs. People are known and it's still","ecstasy and all the other designer drugs that people are doing. And it's still here.",2
478,"here and. It hasn't changed and change is just","And, um, it hasn't changed. It hasn't changed. It's just, it",2
478,"it looks different.","looks different. You",2
478,"You know. We're drug culture. Though.","know. Uh, we're a drug culture though. Not",2
478,"Not just parliament. This country the drug culture as a whole nother story.","just Harlem, but this country has a drug culture. That's a whole nother story. So",2
478,"So yeah. So that was the","yeah. So that was the safety.",2
478,"safety. That was the safety. And the. And","Um, that was the safety. And the, and the",2
478,"the","fact",2
478,"fact that in those years. In New York and I think especially","that in those years in New York, and I think especially in",2
478,"in Harlem.","Harlem, um, living",2
478,"Living alone. As a woman. Had some risk attached to it.","alone as a woman had some risk attached to it. You",2
478,"You know. And I. At the time I didn't have a car I've since owned a lot of cars and sold them to them","know. And I, at the time I didn't have a car. I've since owned a lot of cars and sold them cause they don't make",2
478,"makes sense.","sense.",2
478,"So I rode the train to work.","So I rode the train to work.",1
478,"You know I go get on the tutoring in the train stations we're not like they are now.","You know, I'd go get on that 2 train and the train stations were not like they are now. Not",2
478,"Not anywhere in New York.","anywhere in New York, you",2
478,"You know. Subways were sleazy.","know. Subways were sleazy. Subways ",2
478,"Subways were dirty.","were dirty. People",2
478,"People say the end of the platform they live at the end of the platform and everything that goes of living.","stay the end of the platform. They live at the end of the platform and everything that goes with living, you",2
478,"You know you're naming def again making love cooking eating. The platform.","know, urinating, defecating, making love, cooking, eating. The platform, whatever",2
478,"Whatever you were doing in your life that you had to do it out in public you were doing on the what","you were doing in your life that you had to do it out in public, you were doing on the platform of the",2
478,"Mormonism way. So that the","subway. So the, the trains",2
478,"trains were dangerous and I rode back and forth on these trains for. I feel good.","were dangerous and I rode back and forth on these trains for, I still do. But",2
478,"But they're different trains. So. When I say safety these","they're different trains. So. When I say safety, these places",2
478,"places I've named are all places","I've named were all places that,",2
478,"that. I didn't have to watch my back. That being said.","I didn't have to watch my back. Uh, that being said,",2
478,"There were a lot of other places in New York. Many places in New York. Of it","There were a lot of other places in New York, many places in New York, I also had to watch my back.",2
478,"was just kind of a kind of place Manhattan ever.","It's just kind of the pl-kind of place Manhattan is, I think. And",2
478,"And this had it. Its challenges. And it had its.","this had its, its challenges. And it had its wonder.",2
478,"Wonder. You know it's wonder","You know, it's wonder. It's, um,",2
478,"it's. You know people in the outside view of this neighborhood","you know, people, the, the outside view of this neighborhood might",2
478,"might be that it was.","be that it was drug",2
478,"Drug ridden. Poverty beaten. It was also a place where there","-ridden, poverty-beaten. It was also a place where there were",2
478,"were doctors and still are doctors and lawyers and wonderful musicians and.","doctors and still are, doctors and lawyers and wonderful musicians and teachers",2
478,"Teachers and principals and great","and principals and great education",2
478,"education and. Good living.","and, um, good living. Good living.",2
478,"Good living and. This was. This","And, um, this was, this was",2
478,"was a draw.","a draw.",2
478,"You know I don't know if you know my Strivers Row up there. Not far from here.","You know, I don't know if you know about, um, Strivers' Row up there, not far from here, and",2
478,"And the bronze domes of people now. Move into. Well those were always occupied","the brownstones that people now move into? Well, those were always occupied by",2
478,"by Sam and while","families. And while they",2
478,"they didn't have the drawl that they have","didn't have the draw that they have now",2
478,"now. Terms of real estate value.","in terms of real estate value, there",2
478,"There were always. Bunches of families in there. Sitting on the","were always bunches of families in there, sitting on the stoop.",2
478,"stoop. And so you know those people sitting on their feet. Oh well.","And so you know those people sitting on their s- -- What street is that? -- Oh, well,",2
478,"Strivers rose up in a hundred","Strivers' Row is up at ",2
478,"and thirty feet. Thirty six thirty seven thirty eight thirty nine.","136, 37, 38, 39. And",2
478,"And they're","they're beautiful",2
478,"beautiful beautiful. Brownstones.","beautiful brownstones. What's",2
478,"What's interesting is that that whole area was. Was primarily doctors and lawyers","interesting is that that whole area was, was primarily doctors and lawyers, black",2
478,"what doctors and lawyers and behind those","doctors and lawyers, and behind those buildings",2
478,"buildings were garages. And like a paper street.","were garages. And, like, a paper street. So",2
478,"So the lots were big enough that. That there were garages and places to park behind those.","the lots were big enough that, that there were garages and places to park behind those. There",2
478,"There still are. So you could drive behind those. Those places in Strivers Row","still are. So you could drive behind those, those places in Strivers' Row and",2
478,"and park your","park your car,",2
478,"car which. In New York","which, in New York City,",2
478,"City. Period Amen. And any time is. Is","[Laughs] ?appear any men?. And any time is, is pretty",2
478,"pretty special.","special. Yeah.",2
478,"Yeah. So these places were or","So these places were, were safe.",2
478,"safe. Safe because I was single at the time safe.","Um, safe because I was single at the time, safe because",2
478,"Because I was living in New York City. By myself and safe","uh, I was living in New York City by myself, and safe because",2
478,"because there were still some","there were still some real",2
478,"real. Tensions here and that tension there was there were problems","uh, tensions here and, not tensions, there was, there were problems in",2
478,"in Harlem I remember when I first saw my family.","Harlem. I remember when I first saw my family, uh, when ",2
478,"When I left. Riverdale. I said to","I left, uh, Riverdale. Um, I said to my",2
478,"my family I was moving to her. Olam.","family I was moving to Harlem. And",4
478,"And they were concerned about me living here by myself.","they were concerned about me living here by myself. Um.",4
478,"They thought I should come back to Pittsburgh and move into one of the family house and do something like","They thought I should come back to Pittsburgh and move into one of the family houses, do something like that.",4
478,"that. Concern because of why I came here but also concerned that I didn't","Concerned because of why I came here but also concerned that I didn't really",4
478,"really know. People I didn't have blood family here. Of a didn't.","know people. I didn't have blood family here. 'Cause I didn't. You",4
