"transcript_id","original_text","guess_text","transcript_line_status_id"
143,"in Harlem. At a school a public school. It was very it was going","Harlem at a school- a public school. It was very-it was going very",4
143,"very very well. I've","very very well I-I've",4
143,"always said I've always","always uh I've always",4
143,"been able to organize and facilitate always always always.","been able to organize and facilitate always always always um.",4
143,"I've never really focused on those skills.","I've never really focused on those skills they just",4
143,"They just sort of came out. When I you know I thought of something and like","They just sort of came out when I, you know, I thought of something and like",4
143,"putting this music school together. Or this this music program together just for the place","putting this music school together or this-this music program together just for the place",4
143,"because I saw clearly what needed to be done in did the things that needed to be done and.","because I saw clearly what needed to be done and did the things that needed to be done and",4
143,"If I saw a problem I try to find a solution. You know. Very simple. So that's","If I saw a problem I'd try to find a solution, you know, very simple. So that's",4
143,"how I approach things. If it's. I mean I'm looking at something.","how I approach things. If-If-I mean, I'm looking at something",4
143,"If there's a problem for the solution. And then keep going. You know. And","If there's a problem for the solution and then keep going, you know, and",4
143,"by all","by all means",4
143,"means stay the course. Stay the course.","stay the course. Stay the course.",4
143,"You know. And that comes from my.","And that comes from my",4
143,"My ability to focus because as I told you since I was four I","My um ability to focus because as I told you since I was four I",4
143,"do what I want to do. But that meant what I practiced. I really really","knew what I want to do. But that meant when I practiced, I really really practiced",4
143,"practiced. I'm jumping around a bit I'll get back to it.","practiced. I'm-I'm jumping around a bit, I'll get back to it.",4
143,"But when I was in the service for example. I","But um when I was in the service for example, I",4
143,"was practice so much. The guys would throw me out of","would practice so much the guys would throw me out of",4
143,"the the","the building",4
143,"building. They take that stuff down the","[both laughing] ""Take that stuff down the street.""",4
143,"street so I take my drug good on the street."," so I'd take my drum, go down the street",4
143,"You still do.","""You're still too close!"" [both laughing]",4
143,"I","[laughing continues]",4
143,"say oh you know I mean you you you just. You really become","oh, you know, I mean you-you-you just... you really become consumed",4
143,"consumed by by your involvement."," by- by your involvement [Barry: Yep]",4
143,"Yeah. And I've always been like that.","And I've always been like that.",4
143,"And probably will until I begin losing it. You know. But.","And probably will until I begin losing it, you know, but um",4
143,"So what I have protests something it's pretty complete. I mean I put everything in.","So when I approach something it's pretty complete,I mean, I put everything in and",4
143,"And it's never about me.","And it's never about me, you know",4
143,"You know that's why","You know that's why?",4
143,"I don't like talking about my you know.","I don't like talking about my, you know, accomplishments",4
143,"Accomplishments of the things that I've done it's not about me. You know. I lived it. And","and the things that I've done, it's not about me. You know, yeah I lived it and",4
143,"I can look back and figured I was really nice. I had a great time. And I","I can look back and say it was really nice, I had a great time. And I did",4
143,"did. I really did. Well that's great you know if I did","[laugh] I really did. [Barry: Well that's great] oh yeah yeah I did, I did, I did",4
143,"it but you know. OK."," but uh, you know, OK",4
143,"But someone else talk about. It's not important because there's something else","let someone else talk about. It's not important because there's something else that I",4
143,"that I you know. Would rather talk about or focus on. You know. No.","that I, you know, would rather talk about or focus on, you know",4
143,"You know. Other things coming at the same time.","a lot of things are coming at the same time, um",4
143,"So the focus yes when you know when I'm in practice or","So the focus, yes when you know when I'm in practice or",4
143,"composed of in the beginning when I can possibly.","composed oh in the beginning when I would compose something",4
143,"He was a. Again. While I was in","where was I? Uh, again while I was in the",4
143,"the service"," service",4
143,"I lived in I went away from the base because I didn't want to do the army","I lived an hour away from the base because I didn't want to do the army thing",4
143,"thing yet twenty four hour sort of drive an hour and a half to and from.","[Barry: Yeah] twenty fours so I would drive an hour and a half to and from",4
143,"You know. So that means a formation at six I was up at four. Well. Hey.","You know. So that means a formation at six I was up at four. [Barry: Woah] Hey,",4
143,"I","I meant",4
143,"meant.","meant it [laugh]",4
143,"I did not want to do the everything. You know twenty four hours. But. So I was","I did not want to do the army thing, you know, twenty four hours. But uh- so I was staying",4
143,"staying in Chapel Hill and working on the piece there was","staying in Chapel Hill and working on a piece there was",4
143,"a","a piano",4
143,"piano in the permit which was attached. Attached","in the apartment which was attached-attached",4
143,"to another hole. We have to spread the news.","to a-another home, you know, we had this apartment and there was home",4
143,"And I was trying to work out. Section.","And I was trying to work out the section, and when you get",4
143,"And when you get so focused. Everything blocks up everything is gone. I don't see","And when you get so focused everything blocks out, everything is gone noth- I don't see",4
143,"anything I'm just really you know.","anything I'm just really you know and I'm doing it",4
143,"Doing it and I'm just trying to work it out. And I","Doing it and I'm just trying to work it out. And I hear",4
143,"hear what","hear, ""WILL YOU",4
143,"you","CUT THAT OUT?!"" [both laughing]",4
143,"and I live up surprise you know. Because I had no idea how long I've","and I loo- I'm surprised, you know, [laughs] I- because I had no idea how long I've",4
143,"been doing it you know I guess","been doing it you know I guess it was",4
143,"it was like listening to those two notes of Beethoven Beethoven trying","it was like listening to those two notes of Beethoven. Beethoven trying",4
143,"to figure out what to do with or I was you know.","""dah, dah, dah, dah"" [Barry laughing] trying to figure out what to do with those two notes before I was, you know, [Aaron laughs]",4
143,"I was so I bought a beta of that but trying to say it","[laughing] No Im not a Beethoven I'm not trying to say",4
143,"because what a sweet. But the","because [?]. But the",4
143,"focus. The focus it. It really has helped me through my life"," The focus it. It really has helped me throughout my life",4
143,"and no.","and, um, now. um ",4
143,"After when I was at the school in Harlem. I became ill and that kind of not to be","After when I was at the school in Harlem. I became ill and that kind of knocked me down",4
143,"done for several in the previous almost eight","down for several number views, almost eight",3
143,"years. But I'm slowly. Still slowly. Bouncing back.","me down for several, a number of years. Almost eight years. But I'm slowly. Still slowly. Bouncing back.",4
143,"But my focus know. Is on the","But my focus now Is on the curtain.",4
143,"curtain. And if","curtain. And it",4
143,"it wasn't my choice. I very high. When I","it wasn't my choice. I, uh, very high. When I",4
143,"saw that. You know it.","saw that, uh. You know it, um.",4
143,"When I saw what was happening. It was just thinking.","When I saw what was happening. i was just thinking.",4
143,"You know I I really don't want to do this. I would I","You know I, I really don't want to do this. I would I",4
143,"would lean on the garden center at night and look into it","would lean on the garden fence at night and look into it",4
143,"just so please don't give me this I don't want it because it's huge it's"," so please don't give me this I don't want it because it's huge it's huge",4
143,"huge it's. You know it's there been defining","huge it's you know its, You know it's there been defining",4
143,"moments in my life in everyone's life you have them."," It's in my life in everyone's life you have them but.",4
143,"But things are so huge you just have to"," things are so huge you just have to really",4
143,"really. Sit back and fill bored.","really. Sit back and saw oh lord.",4
143,"I can do this. This is. This is too big for me. You know.","I can't do this. This is. This is too big for me. You know.",4
143,"But some of the very was said to me.","But someone very wise said to me.",4
143,"She","She said",4
143,"said. A job is only as big as you","said, uh. A job is only as big as you",4
143,"are now.","are. [Barry- yeah].",4
143,"So what is your role in the garden. What's my row.","So what is your role in the garden. What's my role.[Barry-yep]",4
143,"Yes. Oh my."," Oh my.",4
143,"What is my","What is my role",4
143,"rule is that the same I don't know","role, um, is that to say am I the new Mr. Reynolds",4
143,"Mr","Mr Reynolds",4
143,"REYNOLDS. Well. I mean in in brass tacks term.","REYNOLDS. Well. it-uh-I mean in in brass tacks term.",4
143,"What. What do you have to","What, um. What do you have to",4
143,"do with a garden.","do for the garden.",4
143,"Everything. No I am not. I cannot","Everything. Um, No I am not, I cannot",4
143,"say I have been to Mr Mills because you can't replace","say I have been new Mr Mills because you can't replace",4
143,"someone like that and I would never never.","someone like that and I would never, never.",4
143,"You know. Hint that I have the new system.","You know. Hint that I am the new Mr.Reynolds.",4
143,"Not because he's you know he's really","No, because he's you know he's really",4
143,"exceptional. Maybe one day I might be very exceptional.","exceptional. Maybe one day I might be very exceptional.",4
143,"Maybe one day we'll see.","Maybe one day we'll see.",4
143,"But my role in","But, um, my role in",4
143,"the garden is to of.","the garden is to uh.",4
143,"Do the best I","Do the best I",4
143,"can","can",4
143,"to keep this a little","to keep this Mr.Reynolds",4
143,"direction and and legacy. Going forward. The best","direction and uh legacy. Going forward. The best",4
143,"I","I",4
143,"can. And that involves organizing people.","can. And that involves organizing people.",4
143,"Oh yeah. Of course. I","Oh yeah. yeah-yeah Of course. I mean",4
143,"mean. There's a lot of I'm not saying.","mean. There's a lot that I'm not saying.",4
143,"But the","But the garden",4
143,"garden is only twenty percent of what needs to be done.","is only twenty percent of what needs to be done. And that",4
143,"And that is a whole lot of work over there across the street that. It's","that is a whole lot of work over there across the street that. It's",4
143,"not growing. You know. Project you're always in the","an ongoing, you know, project, you're always in the garden",4
143,"garden. But that's only twenty percent. And people don't","But that's only twenty percent. And people don't",4
143,"realize you know. So","realize that you know. as a whole",4
143,"all whole nother world a whole other ballgame going","all whole nother world a whole nother ballgame going",4
143,"on that. Also needs to be addressed. If it's going to be done properly.","on that also needs to be addressed if it's going to be done properly.",4
143,"What are some of the things people don't understand about the","What are some of the things people don't understand about the",4
143,"garden. Well the first","garden. Well the first, uh",4
143,"of mistake. Is that it's always closed.","uh mistake. Is that, uh, it's always closed.",4
143,"Now that there are there may be something to that. The fact that I","Now that there are there may be something to that. The past years but I",4
143,"know personally.","know personally,",4
143,"The past year and a half.","the past year and a half",4
143,"The curtain was mostly open all the time. Now. If you","The curtain was mostly open all the time. Now, If you",4
143,"were walking to work. And then walking home. You might see","were walking to work, and then walking home, you might see",4
143,"the","the",4
143,"gate closed. Because you're leaving before. Seven min.","gate closed. Because you're leaving before Seven and.",4
143,"You coming home after fuck. Friend. You know but if you are around during the","You coming home after five. [barry-right] You know, but if you are around during the",4
143,"day. And you still make the claim that would not be an","day. And you still make that claim that would not be an",4
143,"artist claim to make. Not by a longshot. The Guard has","honest claim to make. Not by a longshot. The Garden has",4
143,"been open.","been open.",4
143,"And this year. It is a hopefully who will go along those","And this year. It hopefully will go along those",4
143,"lines as well. Last","lines as well. Last year",2
143,"year there were a lot of events that took place and I don't.","year there were a lot of events that took place in the garden and ",4
143,"And there's always been events in the garden.","And there've always been events in the garden.",2
143,"But","But",4
143,"how can I say the atmosphere.","how can I say the atmosphere",4
143,"Or the conditions that created the","or the conditions that created the",4
143,"garden. No longer exist.","garden. Uh, No longer exist.",4
143,"The conditions that created the good well. It's no longer a dump. They're no longer gangs.","The conditions that created the garden well It's no longer a dump. They're no longer gangs.",4
143,"You know destroying everything. There's a fence around the garden which protects it","You know destroying everything. There's a fence around the garden which protects it",4
143,"because in fact the fence was put up by the Parks Department of the.","because in fact the fence was put up by the Parks Department, uh the",4
143,"The and chain link fence was put","The um chain link fence was put",4
143,"up. Oh it could be.","up. Oh it can be.",4
143,"Be searched but Iraqi government should my stuff and find it.","Be searched but or i could go rummage in my stuff and find it.",4
143,"Take me about ten minutes though. But I","Take me about ten minutes though. But um, [suck teeth], um",4
143,"don't know was put up by the parks. The parks permit because you know at","no, it was put up by the parks. The parks department because you know at",4
143,"the time they felt that the work needed to be protected. Breakers without","the time they felt that the work needed to be protected. Because without",4
143,"the fence.","the fence,",4
143,"You know the dogs were going in the kids were running to the far flower beds you","You know the dogs were going in the kids were running to the f-flower beds you",4
143,"know and. Bruce and Mr Reynolds and members","know and Bruce and Mr Reynolds and members",4
143,"that were helping. You know they were really trying to do good work. There used to","that were helping. Um, you know, they were really trying to do good work. There used to",4
143,"be a gardener. Assigned to us you","be a gardener. Assigned to usher th",4
143,"park who eventually left because the gang would","park who eventually left because the -- the gang would",2
143,"just continuously trash is work. I","just continuously trash his work. I",4
143,"mean yeah. Who doesn't just say it's not worth it after a while yet you","mean yeah. Who doesn't just say it's not worth it after a while [Barry-yea] you",4
143,"know. But OK so the fence went","know. But OK so the fence went",4
143,"up","up, um",4
143,"and and seen the conditions they don't exist. So the fence would up.","and and seen the conditions they don't exist. So the fence went up.",4
143,"What else.","What else, ",4
143,"Well","Well",4
143,"now we have water. Again. I guess in the sixty's there was water.","now we have water, again. I guess in the sixties there was water",4
143,"And the sixty's was when the parks","and the sixties was when the parks",4
143,"trashed. So during the. The rehabilitation of Asian park.","trashed. So during the. The rehabilitation of ishan park.",4
143,"You know the contractors came in","You know the contractors came in",4
143,"and redesigned the park. But they failed to use. Water.","and redesigned the park. But they failed to reinstall the Water.",4
143,"You","You",4
143,"know. So now. The what's back. After thirty years you how to","know. So now. The water's back. After what thirty years, forty years you how to",4
143,"use something like that but OK heredity. And it's a great length. I mean you kidding me. Of course it's","so something like that, but OK, hooray. And it's a great thing. I mean you kidding me. Of course it's",4
143,"a great thing I had. You my you may have known there was a petition.","a great thing I had. You may you may have known there was a petition.",4
143,"Put up.","Put up",4
143,"Of concerning the water project I said.","um concerning the water project. [Barry-I signed it]",4
143,"But it was not against the water project it was just how the","But it was not against the water project, it was just how the",2
143,"water project would go through the garden in Honestly honestly honestly. You know","water project would go through the garden and Honestly honestly honestly. You know",4
143,"I I've you know I understand this is Parks property. I","I, I've, you know, I understand this is Parks property. I",2
143,"understand it. But there's a lot of great work that's been going","understand that. But there's a lot of great work that's been going",2
143,"on for half a century.","on for half a century.",4
143,"Three work. You know.","Free work. You know.",4
143,"Good work. Yeah. Really really good work for the community.","Good work. [Barry-Yeah.] Really really good work for the community. Um,",4
143,"It's statically it's changed the face of the neighborhood. Absolutes change the face of.","ecstatically it's changed the face of the neighborhood. [Barry-Absolute] it's changed the face of.",4
143,"You know how people relate to each other you know. I mean it's not just","You know how people relate to each other, you know. I mean it's not just",2
143,"visual but it's social it's everything. You","visual but it's social, it's everything. You",2
143,"know. So it's not that I feel like","know. Um, so it's -- it's not that I feel like",4
143,"or or I see you ask me what's my role so it would be me.","or or I ?inaudible? you ask me what's my role so it would be me.",4
143,"It's not like I feel like I own that property or","It's not like I feel like I own that property or",1
143,"I'm not it's ridiculous. It's parks property I just and I completely. But the work","I'm no that's ridiculous. It's parks property I just and I completely. But the work",4
143,"that's going on is is worth","that's going on is is worth",1
143,"preserving. And how is that endangered right now.","preserving. And how is that endangered right now.",1
143,"Oh well. The water project. So can the fence right. Which was good","Oh well. The water project. Sorta [?] the fence right. Which was good",4
143,"because you know. You can't. There's a there's a rock shelf. Along the from the garden","because you know. You can't. There's a there's a rock shelf. Along the front of the garden",4
143,"the eastern face.","the eastern face.",1
143,"Just like there was that the building they made. That burned down onto a seventh","Just like there was that the building they made. That they, uh, that burned down on 207th",4
143,"and Broadway. When they started digging sort of rocks Rice out of what they had to go to","and Broadway. When they started digging you saw the rocks the solid rock they had to go ",4
143,"through was the same along the front the Eastern front of the","through was the same along the front, the Eastern front, of the",4
143,"garden and that just would have been a mess it would be ruined the garden would have been more.","garden and that just would've have been a mess it would be ruined the garden would have been more.",4
143,"I'd say of a third. Third of the garden. Would be in ruins","I'd say of a third. at least a Third of the garden. Would be in ruins",4
143,"for two two years.","for two -- two years.",2
143,"Well. OK So that novel was","Well. OK so that battle was won",4
143,"one that was one that was one. But there's also.","That was won, that was won. But there's also",4
143,"There's also talk which is. You know it's been published by the parks apartment that they would like to","There's also talk which is. You know it's been published by the parks department that they would like to",4
143,"take down the fence.","take down the fence.",1
143,"And you know that's just not a good idea because the. The","And you know that's just not a good idea because because The",4
143,"work that being done would be ruined everything would be trashed","work that been done would be ruined everything would be trashed",4
143,"within two months. To it would it would you wouldn't take very long at","within two months. To it would it would, it wouldn't take very long at",4
143,"all you know what's needed is a. You know the","all you know what's needed is a, you know, the",2
143,"continuation of the wrought iron fence. That's what you really needed. There's","continuation of the wrought iron fence. That's what's really needed. There's",4
143,"the Parks Department say why they want the fence to come down.","the Parks Department say why they want the fence to come down?",2
143,"Well there was there was a. They wanted","Well, there was a, they wanted to",2
143,"to make it like Strawberry Fields and","to make it like Strawberry Fields in",4
143,"in Central Park. You know. More accessible. More acceptable but.","in Central Park. You know. More accessible. More accessible but-but.",4
143,"But you know I mean. Well there are plenty","But you know I mean, well there are plenty",2
143,"of gardens that are gated in","of gardens that are gated in",1
143,"the city. You know why single this one out. You","the city. You know, why single this one out? You",2
143,"know it. And this is probably no I have to say.","know it's and-and . And this is probably no I have to say.",4
143,"Gravity park is his family fabulous and there are other.","[Gra?] park is-is fabulous and there are other.",4
143,"Rose garden is in the Rose Garden in Central Park and. Another fabulous gardens","Rose garden's is in the Rose Garden in Central Park and other fabulous gardens",4
143,"but this is a very very very unique garden. Sure it's","but this is a very very unique garden. [Barry-Sure] it's",2
143,"very unique. And it's it's worth showcasing","very unique. And it's it's worth showcasing",1
143,"not destroying.","not destroying.",1
143,"You know. And taking the fence down. You would be destroyed.","You know. And taking the fence down. It would be destroyed. Um",4
143,"What's my","What's my",1
143,"role of protector seems part of What's my","role [Barry- A protector seems part of it] What's my",4
143,"role of. Yes. What's my role as I","role. Um. Yes. What's my role as I",4
143,"said to the best I can to keep Mr REYNOLDS. Legacy going","said to the best I can to keep Mr REYNOLDS Legacy going forward",4
143,"for using all things that are available to","using all things that are available to me",4
143,"be legal and without. You know I'm a","legal I mean im-you know. [Barry-Yeah] You know I'm not",3
143,"crazy.","crazy.",1
143,"But. So that's that's where we are and the. The direction.","But uh. So that's that's where we are and the. The direction.",4
143,"Mr Mills loves the direction the disco and. You know you. Couple years","Mr Mills loves the direction the [?] and. You know you. A Couple years",4
143,"ago he had a problem with the direction but he loves the direction it's going","ago he had a problem with the direction but he loves the direction it's going",1
143,"in now. You know and he and I work very closely. We've been working","in now. You know and he and I work very closely. We've been working",1
143,"very closely","very closely",1
143,"for the past two years now. You know.","for the past, [exhales] almost two years now. You know.",4
143,"Very very closely I do nothing without his approval. You know.","Very very closely I do nothing without his approval. You know.",1
143,"Or at least is important.","Or at least his input.",4
143,"You know I defer to him because it. There is","You know I defer to him because it, there is",2
143,"something to to. You know.","something to to, uh you know, um,",2
143,"That's something that you don't have that much in the older cultures.","that's something that you don't have that much in the older cultures.",2
143,"The older. As in the","The older ethnicities  ",4
143,"cities","ethnicities ",4
143,"of of back of of of.","of of back off [?].",4
143,"I","you know there's",4
143,"you know there's there's a reason that the older people are","you know there's there's a reason that the older people are",1
143,"respected and","respected and",1
143,"revered that reason doesn't exist in this","revered that reason doesn't exist in this",1
143,"culture or. You know the.","culture or. You know um.",4
