"transcript_id","original_text","guess_text","transcript_line_status_id"
447,"It said you were eleven two thousand and fifteen. And this is being recorded at the","It's February 11, 2015, and this is being recorded at the ",4
447,"Jefferson Market library.","Jefferson Market Library. ",4
447,"So John. Tell me a little bit about where you come from and how you","So John, tell me a little bit about where you come from and how you ",4
447,"ended up the writing. You know. In Greenwich","ended up arriving, you know, in Greenwich ",4
447,"Village. So if I go way back to the beginning.","Village. / Wow. Well, if I go way back to the beginning uh- ",4
447,"I grew up on Long Island and","I grew up on Long Island and ",4
447,"the first and Levittown. My father was a dentist he had a practice there. And","first in Levittown. My father was a dentist he had a practice there. And ",4
447,"then eventually we moved to the north shore.","then eventually we moved to uh- the north shore uh- Laurel Hollow, ",4
447,"So I said that area. And","Syosset that area. And ",4
447,"then you know what I schooled there. In calls from Harbor.","then, you know, I went to high school there, in Cold Spring Harbor ",4
447,"And then after that I went to Penn State where I majored in art. There.","and then after that I went to Penn State where I majored in Art- /Mhm/ and there ",4
447,"I met my future wife. You know we lived together","I met my- my [paper shuffling] future wife. You know we lived together ",4
447,"for a few","for a few years ",4
447,"years. And I did most a lot of stuff sure when I was at","and uh- I did mostly a lot of sculpture when I was at Penn ",4
447,"Penn State but I did pay. As well. And then we both went to graduate","State but I- I did paint, as well. And then we both went to graduate ",4
447,"school and. Pratt Institute. That was when I started really living in","school at uh- Pratt Institute and that was when I started really living in the ",4
447,"the city. So to speak and being on my own I come in once in a while but not very","city, so to speak. Being on Long Island I'd come in once in a while but not very ",4
447,"often but I really took to the city limits here.","often. But uh- I really took to the city when I moved here, ",4
447,"Especially Manhattan.","especially Manhattan, ",4
447,"You know. I was spending most of my time and having no I didn't","[paper shuffling] you know, I was spending most of my time in Manhattan even though I lived in ",4
447,"propose. My first","Brooklyn. But uh- my first ",4
447,"place in Manhattan after I got to this would perhaps was a loss that we rented","place in Manhattan after I got finished with Pratt was a loft that we rented ",4
447,"I was twenty eight Street and Broadway.","on uh- West 28th Street and Broadway and uh- ",4
447,"And I was thirty two S Twenty eighth street. And then after that we moved","that was 32 West 28th Street. And then after that we moved ",4
447,"to Little Italy. And there","to Little Italy and lived in a ",4
447,"to a basement. Or from Cleveland place that","uh- a basement storefront on Cleveland Place, that ",4
447,"was a twenty one pleasing place. And was an interesting place because it had","was at 21 Cleveland Place- /Hm/ and uh- it was an interesting place because it had ",4
447,"a store window. Was an old","a store window, it was an old store ",4
447,"store and painted the window with some class for","and we painted the- the window with some glass frost ",4
447,"us and we were able to project our paintings. You know slide on to that","and we were able to project our paintings, you know, slides onto the- ",4
447,"by putting them into the projector backwards. And then projecting Monday would come out from the words","by putting them into the projector backwards and then projecting them on- they would come out frontwards- /Oh wow./",4
447,"I left her standing","if you were standing ",4
447,"outside so that was a lot of fun and people would come and look at","outside, so that was a lot of fun- /Mhm/ and people would come and look at ",4
447,"our work.","our work, ",4
447,"You know flick that with trying to read it","stuff like that. /What time period is ",4
447,"is absent. Around seventy five seventy six. And then we got sick","this about?/ That's in- around '75- '76, and then we got sick of ",4
447,"of the store front because it was too hot.","the store front because it was too hot. Uh- ",4
447,"It had because we were right about the boiler. I mean it was great in winter. But it was still hot","It had- cause we were right about the boiler. I mean, it was great in winter, but it was still hot- too hot ",4
447,"too hot in the summer and there wasn't much light.","in the summer and there wasn't much light. ",4
447,"So then we moved to another last on twenty second Street at thirty two west. Twenty second","So then we moved to another loft on 22nd Street at 32 West 22nd Street, ",4
447,"Street and.","and uh- [clears throat] ",4
447,"It's funny because the last was the former home of the","it's funny because the loft was the former home of the uh- Marxist ",4
447,"Marxist newspaper The Guardian. He and my wife had worked there once","newspaper, The Guardian, /Hm/ and my wife had worked there once ",4
447,"in about nine hundred sixty eight or something so she really took to that. That loft.","in about 1968 or something, so she really took to that- that loft ",4
447,"So we we stayed there for quite some time. And then after that.","so we- we stayed there for quite some time. And then after that, ",4
447,"You know our marriage started falling off. Now. And we split up.","you know, our marriage started falling off, and then we split up ",4
447,"And I went to California for a","and I went to California for a while. ",4
447,"while and then we got back together for a short time and then","And then we got back together for a short time, and then ",4
447,"we moved to","we moved to Brooklyn ",4
447,"Brooklyn. And in Park Slope so we had","and uh- in Park Slope, so we had a ",4
447,"a place on thirty third Street and part","place on 3rd- 3rd Street in Park Slope ",4
447,"slope. But","Hm/ but then, ",4
447,"then you know. And up going back to","uh- you know, I ended up going back to ",4
447,"California for for a short amount of time. And","California for- for a short amount of time, and ",4
447,"then I met a French woman there. And then I sort of moved back to New York","then uh- I met a French woman there and then I sort of moved back to New York ",4
447,"the parents.","via Paris. /Mhm!/ [both laugh] ",4
447,"When","When I- ",4
447,"I when I came back from Paris. You know my","when I came back from Paris I-, you know, my ",4
447,"French girlfriend. I was going to move in with me in New York and I needed a place. So I asked","French girlfriend was gonna move in with me in New York and I needed a place, so I asked ",4
447,"everybody that I knew it finally I found this old artist friend that I knew. Named","everybody that I knew and finally I found this old artist friend that I knew named ",4
447,"Peter why","Peter Wydean [sp?] ",4
447,"Dean. And he he was living at five or four East twelve street.","and he uh- he was living at 504 East 12th Street, ",4
447,"Which eventually became my apartment. But he decided to get","which eventually became my apartment, but he decided to get ",4
447,"married and. When he got married moved to a bigger place","married, and uh- when- when he got married moved to a bigger place ",4
447,"and let me have this little place.","and let me have this little place. /That's ",4
447,"Check again.","great./ So- ",4
447,"So what was it. What was it like there.","And what was it- what was it like there? Can you-",4
447,"It was just private a little bit the place on I'm twelve.","It was- /describe it a little bit, the place on- on 12th? ",4
447,"It was it was really and that's when I moved into it with the floor it was totally shot.","It was- it was really a mess when I moved into it. The floor was totally shot ",4
447,"And Peter had. And I actually had a lot of trouble getting rid of the rats","and Peter had- had actually had a lot of trouble getting rid of the rats ",4
447,"that were in the building. But he was able to do that I made a deal with his landlord.","that were in the building. But he was able to do that, he made a deal with his landlord ",4
447,"And he's got rid of the","and he got rid of the",4
447,"rat. And so when I moved in","rats [laughs]. And uh- so when I moved in ",4
447,"the floor was kind of shot so we had to repair a little bit and","the floor was kind of shot so we had to repair it a little bit, and ",4
447,"then. While we were there. The landlord stopped paying the mortgage.","then uh, while we were there the landlord stopped paying the mortgage ",4
447,"So the government took over the building. And we were trying to co-opt","so the government took over the building and we were trying to co-op ",4
447,"all the apartments. But they couldn't get it. You know Coles. You know. Could","all the apartments but they couldn't get it, you know GOLES, you know, good old ",4
447,"a Lower East Side. Tenants organizations trying to organize that but they","Lower East Side, the tenants organization was trying to organize that but they ",4
447,"couldn't succeed. For some reason. I don't remember exactly why","couldn't succeed for some reason. I don't remember exactly why ",4
447,"but anyway. You know.","but [pause] anyway, you know, ",4
447,"We were able to stay there. And for a while anyway. After that when you know","we were able to stay there a- a- for a while anyway, after that- /Mhm/ but, you know, ",4
447,"the funding had to be repaired.","the plumbing had to be repaired, so ",4
447,"So when the government on the building they did all the repairs. So it was good","when the government owned the building they did all the repairs so it was good, but ",4
447,"then they sold it to somebody else. And then the rain started","then they sold it to somebody else, and then the rent started",4
447,"going. But it was rent stabilized so didn't do it","going up. /Mhm/ But it was rent stabilized so it didn't go up ",4
447,"that much.","that much. /Even after",4
447,"Even after the government didn't own it anymore or. While. Motherwell","the government didn't own it anymore or while-while the government-/ Well, ",4
447,"so it was good that they took up. The building because they did make all the nets. You know","it was good that they took over the building because they did make all the neces- you know, ",4
447,"the essential repairs.","the essential repairs. /Mhm/ ",4
447,"Put in a new riser water riser stuff like that.","Put in a new riser- water riser and stuff like that. /Hm/",4
447,"Repaired the front door. OK.","Repaired the front door, that kind of- /Mhm/ So ",4
447,"So that was good but then they sold it to a private","that was good, but then they sold it to a private uh- developer ",4
447,"developer. And it still remains. Rent stabilized at the time.","so- /And it still remained rent stabilized at the time./ Yeah- ",4
447,"Yeah yeah.","Yeah. Um, can you te- ",4
447,"But it was kind of describe what the apartment look like OK. But had a when I","But it was- can I describe what the apartment looked like? Yeah, okay, well it had a- when I moved in  ",4
447,"was did have a little bath","it had a little bathtub ",4
447,"tub in in the center of the kitchen. And then there was","in- in the center of the- the kitchen and then there was a ",4
447,"a better amount one and in a little bedroom on the other end. And I use one of the bedrooms as my studio.","bedroom on one end and a little bedroom on the other end. And I used one of the bedrooms as my studio ",4
447,"And the other one was just big enough to fit a queen sized bed and it. But you could.","and the other one was just big enough to fit a- a queen sized bed in it, but you couldn't, ",4
447,"You know maybe had two feet of extra space. Enough to stick a dresser in.","you know, maybe had two feet of extra space. Enough to stick a dresser in /Mhm/ and ",4
447,"And that was it with there was no room in the bedroom for any furniture hitting like","that was it. There- there was no room in the bedroom for any furniture or anything like that. ",4
447,"that and that I had to store my paintings.","Hm/ And then I had to store my paintings, so ",4
447,"So I stored the big paintings in my. What I called my studio which was really that","I- I stored the big paintings in my- what I called my studio which was really that bedroom, ",4
447,"bedroom which was a little bigger than the other one with that.","which was a little bigger than the other one without, ",4
447,"You know.","you know, ",4
447,"But I put the doors all the around. The ceiling.","but uh- I put uh- doors all the around the ceiling, just ",4
447,"Just high enough so I could stack my","high enough so I could stack my paintings ",4
447,"paintings in you know so it was like two feet down from the ceiling. But I had high ceilings.","and, you know, so it was like two feet down from the ceiling. But I had high ceilings which ",4
447,"Which was a good thing. So I had all my pain stored in a corner all the way","was a- a good thing. /Mhm/ So I had all my paintings stored in a- going all the way ",4
447,"around the entire department","around the entire department up high. ",4
447,"apart and.","Wow. And uh- tell me ",4
447,"Tell me about what. What do you mind if I ask what the rent would have been at the time.","about what- what- do you mind if I ask what the rent would have been at the time ",4
447,"In this time","in this time period?/ Well actually, ",4
447,"Elaine you know what I believe then the rent was relative to what everyone else was paying it was","when I moved in, the rent was, relative to what everyone else was paying, it was very ",4
447,"very lucky. I think I was paying for sixty eight which was","low. I- I think I was paying [$]468 /Wow./ Which was ",4
447,"actually a lot more than I paid in my","actually a lot more than I paid in my",4
447,"last has brought you know.","loft, because the loft, you know, there was ",4
447,"There was a spike in red. Just think started go out very quickly and buy","a spike in rents as things started go up very quickly, and my- ",4
447,"my big lot that I had on","my big loft that I had on uh-",4
447,"the twenty second Street. I was ten like three hundred dollars a month.","22nd Street I was paying like $300 a month- /Wow!/",4
447,"Wow. Then ended up by the time I got there was paying three six","Then I ended up- by the time I left I was paying $350 a ",4
447,"C.M.'s. But I couldn't keep it.","month. /Wow./ But I- I couldn't keep it. ",4
447,"And that was about what time","And that was about what time ",4
447,"to write. If I if I had more force I I would have kept it.","period?/ If I- if I had more foresight I- I would have kept it but",4
447,"But at the same time I was still having a stable relationship. If I","at the same time, I was still- I had an unstable relationship. If- if I ",4
447,"had a stable marriage. I would have made an","had a stable marriage I would have made an ",4
447,"attempt to buy the place. And because it probably would have","attempt to buy that place /Hm hm/ then, because it probably would have been ",4
447,"been less than a hundred thousand dollars to","less than $100,000 to ",4
447,"buy. And","buy. /Hm, wow. And ",4
447,"so what year are we talking about that the rent would have","so uh- what year are we talking about that the rent would have ",4
447,"been you know","been, you know, on- ",4
447,"I'm at a to seventy a seventy eight and then on twelfth","at this-/ 1978. /1978, and then on 12th Street ",4
447,"Street with the rent that like for fifty for a two bedroom that","with the rent at like [$]450 for a two bedroom that would- ",4
447,"would if I was for six years and then it went up to to five twenty five and then. By the","Well, it was [$]468 and then it went up to- to [$]525 and then by the ",4
447,"time I left it was five forty five five","time I left it was [$]545- 550. ",4
447,"fifty. And you left there.","Hm/ something like that. /And you left there- ",4
447,"That's when I got into West.","That's when I got into Westbeth. /Mhm-  ",4
447,"And when was that. And two thousand and","and when was that?/ In 2001. ",4
447,"one. And good news.","Mhm. And uh- can you, you know, ",4
447,"You know describe what the area with like on twelfth Street when you were living on twelfth Street.","describe what the area was like on 12th Street when you were living on 12th Street? Wh- What- ",4
447,"What have","Yeah, I ",4
447,"I can. I can give you an idea. There was a lot of crime. And","can uh- I can give you an idea. It- there was a lot of crime and ",4
447,"I had bars on all my windows so it looked like I was living in a cage.","I had bars on all my windows so it looked like I was living in a cage- /Wow./",4
447,"Wound that kind of a big bars. You know","that kind of thing, big bars, you know, with ",4
447,"with. You know. Fortunately one of them was a legal","uh- you know, fortunately one of them was a legal one. ",4
447,"Warren Moon you. You can't put a lock on it but it has a little box that can be","Hm/ You can't put a lock on it but it has a little box that can be opened ",4
447,"open with the latch inside the box. So that it's very difficult to get to it from the","with a latch inside the box so that it's very difficult to get to it from the outside. ",4
447,"outside the twelfth","Mhm. 12th and ",4
447,"and what. It's between A and first look","what?/ Uh- it's between A and 1st. /Oh okay, ",4
447,"a actually between a. Little bit.","mhm, and- /Actually between A and B- /Mhm/ a little bit, just  ",4
447,"Just you know most say.","you know- /Hm/ close to A. /Yeah.",4
447,"Yeah. So what that time there was a lot of a lot of crime it wasn't","Yeah. So at that time there was a lot of- a lot of crime, it wasn't ",4
447,"a safe a lot of drugs a lot of it was just and","a safe- /There was a lot of drugs, a lot of crime. It was just ending, ",4
447,"it was just starting and there were you know. They","it was just starting to end. There were, you know, they were ",4
447,"were addicting. People who were squatting during the time I live there and","evicting people who were squatting during the time I lived there, and they had ",4
447,"they had big tanks coming in the city had these go Terry vehicles. And they also","big tanks coming in- the city had these military vehicles, and they also had ",4
447,"had command posts everywhere for tapping people's","command posts everywhere for tapping people's phones ",4
447,"phones. It was really militarized","[laughs]. /Wowww!/ It was really a militarized area ",4
447,"area for a while. This was going in and he's still in the seventh just in the. Yeah.","for a while. /This was in- in / In the East Village. /in the 70's? In the- / Yeah.",4
447,"Wow. Well you know the seventy's I can't remember exactly why your I","Wow./ Well, you know, the 70's. I can't remember exactly what year I ",4
447,"moved into West. But I mean I can remember that day","moved into Westbeth, but- /Mhm/ I mean I- I- I can remember that day ",4
447,"but yeah. Surrounded me five something","but- /Yeah, yeah./ it was around '85, something like ",4
447,"like wow. I didn't realize it was","'86. /Wow. I didn't realize it was uh- ",4
447,"so it was like that over there at that time period.","it was like that over there at that time period.",4
447,"Yeah. It was sort","Yeah. It was sort of- ",4
447,"of. That I can","I- I can",4
447,"remember there was an Arab guy on the corner you sell","remember uh- there was an Arab guy on the corner used to sell",4
447,"newspapers and old very old man. You know. But he always wore","newspapers. An old, very old man, you know, but he always wore ",4
447,"his you know. This","his, you know, his ",4
447,"is kind of clothing.","imam kind of clothing- /Mhm/ you know. ",4
447,"I don't know what you call","I don't know what you would call",4
447,"that. Maybe a Jew lover or something.","that, uh- maybe a djellaba or something. /Mhm/ ",4
447,"But these kids came and put crazy glue in all the locks. So he could one day he came","But these kids came and put crazy glue in all the locks, so he could- one day he came and ",4
447,"he couldn't open this is his new","he couldn't open his- his newsstand.",4
447,"step. Putting it in","Oh- oh poor guy!/ And that's  ",4
447,"it's sort of the what went in there was.","sort of the- what way the neighborhood was, /Hm, hm/ ",4
447,"You know and batteries were stolen out of cars. Quite a","you know, and batteries were stolen out of cars quite a bit. ",4
447,"bit. Well. And then when","Hm. Yeah, wow. And then when ",4
447,"you move from. There had to","you moved from there, had it ",4
447,"change it it's their educational I had a change to live by the time by two thousand and one it was.","changed?/ It- it had changed a lot- /Had it started to improve?/ It had changed a lot. By the time- by 2001 it was a ",4
447,"A pretty good neighbor. Wasn't perfect but it was a pretty good.","pretty good neighborbood. /Mhm/ It wasn't perfect, but it was a pretty good neighborhood. /Mhm, yeah. ",4
447,"Any other stories or like. You know some things.","Any other uh- stories or like, you know, something ",4
447,"You know stemming the military tanks and. That's surprising to me without a","you know, I mean the military tanks and- that's surprising to me-/ Well, it's not a real ",4
447,"real tank but it was so people like","tank but it was a vehicle like a, ",4
447,"a pretty substantial looking.","you know, pretty substantial looking, you know, bulletproof ",4
447,"Bulletproof kind of fame. Army it was an armored vehicle. Because it was an","kind of thing. /Hm/ Arm- it was an armored vehicle, I guess you'd call it, but it wasn't a tank ",4
447,"attack to never terror this","it didn't have a turret with a spinning /Uh uh/ cannon on it. ",4
447,"can.","Mhm, oh that's good [both laugh]! Ah- ",4
447,"It so any other things like that that you know stick out in your mind are stories","so any other things like that that, you know, stick out in your mind, or stories ",4
447,"like that fellow with the. You know the newsstand. You know any of the","like the fellow with the, you know, with the uh- newsstand, you know, any- any other, ",4
447,"other you know","you know, little ",4
447,"little things that might come to your mind about that time period in","things that might come to your mind about that time period and ",4
447,"that neighborhood.","that neighborhood?",4
447,"I don't know you know I was outside painting all the time. So I'd see a lot of things and Tompkins","I don't know, you know, I was outside painting all the time so I'd see a lot of things and Tompkins ",4
447,"Square Park was renovated. During that time.","Square Park was renovated during that time and ",4
447,"And I can remember years ago. Before that when","uh- I can remember years ago before that when ",4
447,"I visited the place. The park was open all night. And now they had a curfew on the","I visited the place the park was open all night and now they had a curfew on the park, ",4
447,"part. So they close it at a certain time.","so they close it at a certain time, you know. /Hm/",4
447,"And they also had","And they also had a- ",4
447,"a bad show which was demolished by the","a bandshell which was demolished by the city ",4
447,"city and. That was sort of people were upset about that","and uh- that was sort of- people were upset about that ",4
447,"because it was","because it was",4
447,"donated by a family.","donated by a- a family, you know, ",4
447,"And the family was upset about the banjo street as well.","and the family was upset about the band shell being destroyed as well. /Hm, hm. ",4
447,"Did they have AS","Did they have um- ",4
447,"and soon the show. I have that hope","events in the band shell at all- at all?/ Yeah, they had political ",4
447,"political.","[laughs] uh- anti-government ",4
447,"Anti-government speeches that were made on that bench.","speeches that were made on that band shell. And guerilla ",4
447,"Guerrilla theater and stuff like","theater and stuff like that, ",4
447,"that. Could you talk a little bit more about that.","you know. /Huh. Could you talk a little bit more about that?",4
447,"Well. I don't really know that much about it but I just remember that part","Well, I don't really know that much about it- /Mhm/ but I just remember that part of it. ",4
447,"of it. I mean there.","Mm./ I mean, there- ",4
447,"There were a lot of fights with the police but that was before I leave that. Just before I moved in they","there were a lot of fights with the police but that was before I moved in, just before I moved in they had ",4
447,"had some","some- some big, ",4
447,"big big trouble.","big trouble. /Hm. Hmm. Hm, wow.",4
447,"But you know a lot of it was about gentrification","But, you know, a lot of it was about gentrification which ",4
447,"which we witnessed over","we witnessed over time, ",4
447,"time. You know that in the neighborhood and.","you know, living in that neighborhood and uh- it's ",4
447,"It's certainly the neighborhoods are a lot safer and.","certainly the neighborhoods are a lot safer and it- ",4
447,"But there was definitely a loss of","but there was definitely a loss of diversity. ",4
447,"diversity.","Mhm. Hmm. Yeah. ",4
447,"Yeah. What other kinds of. You know businesses still are.","Um- what other kinds of, you know, businesses or, ",4
447,"You know things were in that.","you know, things were in that- that ",4
447,"That area at the time. Well you know you could.","area at the time?/ Well you know, you could ",4
447,"You could always go to a restaurant. Like a potion restaurant","always go to a restaurant, like a Polish restaurant ",4
